15:27:09.515394 IP 10.1.110.119.17500 > 255.255.255.255.17500: UDP, length 156
15:27:09.515401 IP 10.1.110.119.17500 > 10.1.255.255.17500: UDP, length 156
15:27:09.702269 IP 10.1.110.119.17500 > 255.255.255.255.17500: UDP, length 156
15:27:09.702408 IP 10.1.110.119.17500 > 10.1.255.255.17500: UDP, length 156
15:27:10.108424 IP 10.1.110.119.17500 > 255.255.255.255.17500: UDP, length 156
15:27:10.108475 IP 10.1.110.119.17500 > 10.1.255.255.17500: UDP, length 156
15:27:10.212803 IP 10.1.110.119.17500 > 255.255.255.255.17500: UDP, length 156
15:27:10.212806 IP 10.1.110.119.17500 > 10.1.255.255.17500: UDP, length 156
15:27:10.325147 IP 10.1.110.119.17500 > 255.255.255.255.17500: UDP, length 156
15:27:10.325250 IP 10.1.110.119.17500 > 10.1.255.255.17500: UDP, length 156
15:27:12.280153 IP 10.1.110.119.17500 > 10.1.255.255.17500: UDP, length 156
15:27:12.280294 IP 10.1.110.119.17500 > 255.255.255.255.17500: UDP, length 156
15:27:12.358766 IP 10.1.110.119.17500 > 10.1.255.255.17500: UDP, length 156
15:27:12.358914 IP 10.1.110.119.17500 > 255.255.255.255.17500: UDP, length 156
15:27:12.359195 IP 10.1.110.119.17500 > 255.255.255.255.17500: UDP, length 156
15:27:12.459865 IP 10.1.110.119.17500 > 255.255.255.255.17500: UDP, length 156
15:27:12.459909 IP 10.1.110.119.17500 > 10.1.255.255.17500: UDP, length 156
15:27:12.552365 IP 10.1.110.119.17500 > 10.1.255.255.17500: UDP, length 156
15:27:12.606687 IP 10.1.110.119.17500 > 255.255.255.255.17500: UDP, length 156
15:27:12.606733 IP 10.1.110.119.17500 > 10.1.255.255.17500: UDP, length 156
15:27:12.764931 IP 10.1.110.119.17500 > 255.255.255.255.17500: UDP, length 156
15:27:12.764933 IP 10.1.110.119.17500 > 10.1.255.255.17500: UDP, length 156
15:27:17.956680 IP 10.0.0.9.43462 > 78.46.49.212.45550: Flags [F.], seq 611195855, ack 3695363064, win 58, options [nop,nop,TS val 267968198 ecr 1977254111], length 0
15:27:18.204759 IP 78.46.49.212.45550 > 10.0.0.9.43462: Flags [F.], seq 1, ack 1, win 43, options [nop,nop,TS val 1977274818 ecr 267968198], length 0
15:27:18.205284 IP 10.0.0.9.43462 > 78.46.49.212.45550: Flags [.], ack 2, win 58, options [nop,nop,TS val 267968447 ecr 1977274818], length 0
15:27:23.956477 IP 10.0.0.9.56467 > 8.8.8.8.53: 38924+ A? bcn.pool.minergate.com. (40)
15:27:23.956508 IP 10.0.0.9.56467 > 8.8.8.8.53: 59940+ AAAA? bcn.pool.minergate.com. (40)
15:27:24.008640 IP 8.8.8.8.53 > 10.0.0.9.56467: 38924 5/0/0 A 176.9.2.145, A 78.46.49.212, A 46.4.119.208, A 94.130.9.194, A 176.9.147.78 (120)
15:27:24.146437 IP 8.8.8.8.53 > 10.0.0.9.56467: 59940 0/1/0 (121)
15:27:26.138043 IP 176.9.2.145.45550 > 10.0.0.5.48770: Flags [P.], seq 2395209085:2395209369, ack 1911862969, win 43, options [nop,nop,TS val 751857601 ecr 3233037389], length 284
15:27:30.982361 IP 10.0.0.1 > 10.0.0.254: ICMP echo request, id 6537, seq 1, length 64
15:27:30.982420 IP 10.0.0.254 > 10.0.0.1: ICMP echo reply, id 6537, seq 1, length 64
15:27:34.328983 IP 176.9.2.145.45550 > 10.0.0.8.50784: Flags [P.], seq 226722652:226722936, ack 1908763806, win 43, options [nop,nop,TS val 751865793 ecr 3895307509], length 284
15:27:34.415151 IP 10.0.0.6 > 224.0.0.252: igmp v2 report 224.0.0.252
15:27:34.415187 IP 10.0.0.6 > 224.0.0.252: igmp v2 report 224.0.0.252
15:27:34.415214 IP 10.0.0.7 > 224.0.0.2: igmp leave 224.0.0.252
15:27:34.415223 IP6 fe80::d9ab:2882:cc66:5231.62810 > ff02::1:3.5355: UDP, length 33
15:27:34.415368 IP6 fe80::d9ab:2882:cc66:5231 > ff02::16: HBH ICMP6, multicast listener report v2, 1 group record(s), length 28
15:27:34.415382 IP6 fe80::d9ab:2882:cc66:5231 > ff02::16: HBH ICMP6, multicast listener report v2, 1 group record(s), length 28
15:27:34.525372 IP 10.0.0.1 > 10.0.0.254: ICMP echo request, id 6543, seq 1, length 64
15:27:34.525419 IP 10.0.0.254 > 10.0.0.1: ICMP echo reply, id 6543, seq 1, length 64
15:27:34.538451 IP6 fe80::d9ab:2882:cc66:5231 > ff02::16: HBH ICMP6, multicast listener report v2, 1 group record(s), length 28
15:27:34.538457 IP6 fe80::d9ab:2882:cc66:5231 > ff02::16: HBH ICMP6, multicast listener report v2, 1 group record(s), length 28
15:27:34.538459 IP 10.0.0.6 > 224.0.0.2: igmp leave 224.0.0.252
15:27:34.538466 IP6 fe80::d9ab:2882:cc66:5231 > ff02::16: HBH ICMP6, multicast listener report v2, 1 group record(s), length 28
15:27:34.538520 IP 10.0.0.6.62810 > 224.0.0.252.5355: UDP, length 33
15:27:34.538700 IP6 fe80::d9ab:2882:cc66:5231 > ff02::16: HBH ICMP6, multicast listener report v2, 1 group record(s), length 28
15:27:34.538747 IP 10.0.0.7 > 224.0.0.252: igmp v2 report 224.0.0.252
15:27:34.630992 IP6 fe80::d9ab:2882:cc66:5231 > ff02::16: HBH ICMP6, multicast listener report v2, 1 group record(s), length 28
15:27:34.630998 IP 10.0.0.6 > 224.0.0.2: igmp leave 224.0.0.252
15:27:34.631002 IP 10.0.0.7 > 224.0.0.2: igmp leave 224.0.0.252
15:27:34.631081 IP6 fe80::d9ab:2882:cc66:5231 > ff02::16: HBH ICMP6, multicast listener report v2, 1 group record(s), length 28
15:27:34.631084 IP 10.0.0.7 > 224.0.0.252: igmp v2 report 224.0.0.252
15:27:34.631088 IP6 fe80::d9ab:2882:cc66:5231.62810 > ff02::1:3.5355: UDP, length 33
15:27:34.631091 IP 10.0.0.7.62810 > 224.0.0.252.5355: UDP, length 33
15:27:34.631253 IP6 fe80::d9ab:2882:cc66:5231 > ff02::16: HBH ICMP6, multicast listener report v2, 1 group record(s), length 28
15:27:34.699346 IP 10.0.0.7 > 224.0.0.252: igmp v2 report 224.0.0.252
15:27:34.699349 IP 10.0.0.6 > 224.0.0.252: igmp v2 report 224.0.0.252
15:27:34.858352 IP6 fe80::d9ab:2882:cc66:5231 > ff02::16: HBH ICMP6, multicast listener report v2, 1 group record(s), length 28
15:27:34.957042 IP6 fe80::d9ab:2882:cc66:5231 > ff02::16: HBH ICMP6, multicast listener report v2, 1 group record(s), length 28
15:27:34.957044 IP 10.0.0.2 > 224.0.0.2: igmp leave 224.0.0.252
15:27:34.957081 IP6 fe80::d9ab:2882:cc66:5231 > ff02::16: HBH ICMP6, multicast listener report v2, 1 group record(s), length 28
15:27:34.957084 IP 10.0.0.2 > 224.0.0.252: igmp v2 report 224.0.0.252
15:27:35.011219 IP 10.0.0.2 > 224.0.0.2: igmp leave 224.0.0.252
15:27:35.011265 IP 10.0.0.2 > 224.0.0.252: igmp v2 report 224.0.0.252
15:27:35.011318 IP6 fe80::d9ab:2882:cc66:5231 > ff02::16: HBH ICMP6, multicast listener report v2, 1 group record(s), length 28
15:27:35.092820 IP6 fe80::d9ab:2882:cc66:5231 > ff02::16: HBH ICMP6, multicast listener report v2, 1 group record(s), length 28
15:27:35.092824 IP 10.0.0.2.62810 > 224.0.0.252.5355: UDP, length 33
15:27:35.092826 IP6 fe80::d9ab:2882:cc66:5231.62810 > ff02::1:3.5355: UDP, length 33
15:27:35.092856 IP 10.0.0.3 > 224.0.0.2: igmp leave 224.0.0.252
15:27:35.092910 IP6 fe80::d9ab:2882:cc66:5231 > ff02::16: HBH ICMP6, multicast listener report v2, 1 group record(s), length 28
15:27:35.092911 IP 10.0.0.7.62810 > 224.0.0.252.5355: UDP, length 33
15:27:35.092961 IP6 fe80::d9ab:2882:cc66:5231.62810 > ff02::1:3.5355: UDP, length 33
15:27:35.093017 IP6 fe80::d9ab:2882:cc66:5231.62810 > ff02::1:3.5355: UDP, length 33
15:27:35.185021 IP6 fe80::d9ab:2882:cc66:5231 > ff02::16: HBH ICMP6, multicast listener report v2, 1 group record(s), length 28
15:27:35.185025 IP 10.0.0.4 > 224.0.0.2: igmp leave 224.0.0.252
15:27:35.235450 IP6 fe80::d9ab:2882:cc66:5231 > ff02::16: HBH ICMP6, multicast listener report v2, 1 group record(s), length 28
15:27:35.235453 IP 10.0.0.3 > 224.0.0.2: igmp leave 224.0.0.252
15:27:35.235517 IP6 fe80::d9ab:2882:cc66:5231 > ff02::16: HBH ICMP6, multicast listener report v2, 1 group record(s), length 28
15:27:35.235520 IP6 fe80::d9ab:2882:cc66:5231 > ff02::16: HBH ICMP6, multicast listener report v2, 1 group record(s), length 28
15:27:35.240172 IP 10.0.0.3 > 224.0.0.252: igmp v2 report 224.0.0.252
15:27:35.240180 IP 10.0.0.3 > 224.0.0.252: igmp v2 report 224.0.0.252
15:27:35.240184 IP 10.0.0.3.62810 > 224.0.0.252.5355: UDP, length 33
15:27:35.240187 IP6 fe80::d9ab:2882:cc66:5231.62810 > ff02::1:3.5355: UDP, length 33
15:27:35.240191 IP 10.0.0.4 > 224.0.0.252: igmp v2 report 224.0.0.252
15:27:35.240193 IP 10.0.0.4 > 224.0.0.252: igmp v2 report 224.0.0.252
15:27:35.240195 IP 10.0.0.6.62810 > 224.0.0.252.5355: UDP, length 33
15:27:35.491739 IP6 fe80::d9ab:2882:cc66:5231.62810 > ff02::1:3.5355: UDP, length 33
15:27:35.491889 IP6 fe80::d9ab:2882:cc66:5231 > ff02::16: HBH ICMP6, multicast listener report v2, 1 group record(s), length 28
15:27:35.492024 IP6 fe80::d9ab:2882:cc66:5231 > ff02::16: HBH ICMP6, multicast listener report v2, 1 group record(s), length 28
15:27:35.492167 IP 10.0.0.4 > 224.0.0.2: igmp leave 224.0.0.252
15:27:35.492303 IP6 fe80::d9ab:2882:cc66:5231 > ff02::16: HBH ICMP6, multicast listener report v2, 1 group record(s), length 28
15:27:35.492436 IP 10.0.0.4.62810 > 224.0.0.252.5355: UDP, length 33
15:27:35.493674 IP 10.0.0.2 > 224.0.0.252: igmp v2 report 224.0.0.252
15:27:35.573240 IP6 fe80::d9ab:2882:cc66:5231 > ff02::16: HBH ICMP6, multicast listener report v2, 1 group record(s), length 28
15:27:35.573350 IP 10.0.0.3 > 224.0.0.252: igmp v2 report 224.0.0.252
15:27:35.573518 IP6 fe80::d9ab:2882:cc66:5231 > ff02::16: HBH ICMP6, multicast listener report v2, 1 group record(s), length 28
15:27:35.573658 IP 10.0.0.4 > 224.0.0.252: igmp v2 report 224.0.0.252
15:27:35.573809 IP6 fe80::d9ab:2882:cc66:5231 > ff02::16: HBH ICMP6, multicast listener report v2, 1 group record(s), length 28
15:27:35.774302 IP6 fe80::d9ab:2882:cc66:5231.62810 > ff02::1:3.5355: UDP, length 33
15:27:35.774306 IP 10.0.0.2.62810 > 224.0.0.252.5355: UDP, length 33
15:27:35.871395 IP6 fe80::d9ab:2882:cc66:5231.62810 > ff02::1:3.5355: UDP, length 33
15:27:35.871420 IP 10.0.0.3.62810 > 224.0.0.252.5355: UDP, length 33
15:27:35.871483 IP6 fe80::d9ab:2882:cc66:5231.62810 > ff02::1:3.5355: UDP, length 33
15:27:35.871588 IP 10.0.0.4.62810 > 224.0.0.252.5355: UDP, length 33
15:27:38.426744 IP 176.9.2.145.45550 > 10.0.0.9.53914: Flags [P.], seq 3685173605:3685173889, ack 2515127681, win 43, options [nop,nop,TS val 751869889 ecr 1114192071], length 284
15:27:40.083326 IP 10.0.0.11 > 224.0.0.2: igmp leave 224.0.0.252
15:27:40.083388 IP 10.0.0.11 > 224.0.0.2: igmp leave 224.0.0.252
15:27:40.083392 IP6 fe80::d9ab:2882:cc66:5231 > ff02::16: HBH ICMP6, multicast listener report v2, 1 group record(s), length 28
15:27:40.083448 IP6 fe80::d9ab:2882:cc66:5231 > ff02::16: HBH ICMP6, multicast listener report v2, 1 group record(s), length 28
15:27:40.083497 IP6 fe80::d9ab:2882:cc66:5231 > ff02::16: HBH ICMP6, multicast listener report v2, 1 group record(s), length 28
15:27:40.083556 IP 10.0.0.14 > 224.0.0.2: igmp leave 224.0.0.252
15:27:40.083560 IP 10.0.0.11 > 224.0.0.252: igmp v2 report 224.0.0.252
15:27:40.083628 IP 10.0.0.14 > 224.0.0.252: igmp v2 report 224.0.0.252
15:27:40.083681 IP6 fe80::d9ab:2882:cc66:5231 > ff02::16: HBH ICMP6, multicast listener report v2, 1 group record(s), length 28
15:27:40.083953 IP 10.0.0.6.62816 > 239.255.255.250.1900: UDP, length 173
15:27:40.163294 IP 10.0.0.14 > 224.0.0.252: igmp v2 report 224.0.0.252
15:27:40.163352 IP6 fe80::d9ab:2882:cc66:5231.62810 > ff02::1:3.5355: UDP, length 33
15:27:40.163409 IP6 fe80::d9ab:2882:cc66:5231 > ff02::16: HBH ICMP6, multicast listener report v2, 1 group record(s), length 28
15:27:40.163410 IP6 fe80::d9ab:2882:cc66:5231 > ff02::16: HBH ICMP6, multicast listener report v2, 1 group record(s), length 28
15:27:40.163411 IP6 fe80::d9ab:2882:cc66:5231 > ff02::16: HBH ICMP6, multicast listener report v2, 1 group record(s), length 28
15:27:40.163411 IP 10.0.0.14 > 224.0.0.2: igmp leave 224.0.0.252
15:27:40.163458 IP6 fe80::d9ab:2882:cc66:5231 > ff02::16: HBH ICMP6, multicast listener report v2, 1 group record(s), length 28
15:27:40.163458 IP 10.0.0.14.62810 > 224.0.0.252.5355: UDP, length 33
15:27:40.163509 IP 10.0.0.16 > 224.0.0.2: igmp leave 224.0.0.252
15:27:40.163510 IP6 fe80::d9ab:2882:cc66:5231 > ff02::16: HBH ICMP6, multicast listener report v2, 1 group record(s), length 28
15:27:40.227451 IP 10.0.0.15 > 224.0.0.2: igmp leave 224.0.0.252
15:27:40.227493 IP6 fe80::d9ab:2882:cc66:5231 > ff02::16: HBH ICMP6, multicast listener report v2, 1 group record(s), length 28
15:27:40.227552 IP 10.0.0.7.62816 > 239.255.255.250.1900: UDP, length 173
15:27:40.227867 IP6 fe80::d9ab:2882:cc66:5231 > ff02::16: HBH ICMP6, multicast listener report v2, 1 group record(s), length 28
15:27:40.227920 IP 10.0.0.11 > 224.0.0.252: igmp v2 report 224.0.0.252
15:27:40.227974 IP 10.0.0.11.62810 > 224.0.0.252.5355: UDP, length 33
15:27:40.228030 IP 10.0.0.10 > 224.0.0.2: igmp leave 224.0.0.252
15:27:40.280266 IP6 fe80::d9ab:2882:cc66:5231 > ff02::16: HBH ICMP6, multicast listener report v2, 1 group record(s), length 28
15:27:40.280281 IP6 fe80::d9ab:2882:cc66:5231.62810 > ff02::1:3.5355: UDP, length 33
15:27:40.280348 IP 10.0.0.10 > 224.0.0.2: igmp leave 224.0.0.252
15:27:40.384999 IP 10.0.0.10 > 224.0.0.252: igmp v2 report 224.0.0.252
15:27:40.385056 IP 10.0.0.10 > 224.0.0.252: igmp v2 report 224.0.0.252
15:27:40.385061 IP 10.0.0.10.62810 > 224.0.0.252.5355: UDP, length 33
15:27:40.385133 IP6 fe80::d9ab:2882:cc66:5231.62810 > ff02::1:3.5355: UDP, length 33
15:27:40.385137 IP 10.0.0.16 > 224.0.0.252: igmp v2 report 224.0.0.252
15:27:40.385140 IP 10.0.0.16 > 224.0.0.252: igmp v2 report 224.0.0.252
15:27:40.385172 IP 10.0.0.16 > 224.0.0.2: igmp leave 224.0.0.252
15:27:40.385235 IP6 fe80::d9ab:2882:cc66:5231.62810 > ff02::1:3.5355: UDP, length 33
15:27:40.385239 IP 10.0.0.16.62810 > 224.0.0.252.5355: UDP, length 33
15:27:40.385241 IP 10.0.0.15 > 224.0.0.252: igmp v2 report 224.0.0.252
15:27:40.385278 IP 10.0.0.15 > 224.0.0.252: igmp v2 report 224.0.0.252
15:27:40.385338 IP6 fe80::d9ab:2882:cc66:5231 > ff02::16: HBH ICMP6, multicast listener report v2, 1 group record(s), length 28
15:27:40.452979 IP6 fe80::d9ab:2882:cc66:5231 > ff02::16: HBH ICMP6, multicast listener report v2, 1 group record(s), length 28
15:27:40.452993 IP6 fe80::d9ab:2882:cc66:5231 > ff02::16: HBH ICMP6, multicast listener report v2, 1 group record(s), length 28
15:27:40.452998 IP6 fe80::d9ab:2882:cc66:5231 > ff02::16: HBH ICMP6, multicast listener report v2, 1 group record(s), length 28
15:27:40.453065 IP6 fe80::d9ab:2882:cc66:5231 > ff02::16: HBH ICMP6, multicast listener report v2, 1 group record(s), length 28
15:27:40.453180 IP6 fe80::d9ab:2882:cc66:5231 > ff02::16: HBH ICMP6, multicast listener report v2, 1 group record(s), length 28
15:27:40.453182 IP6 fe80::d9ab:2882:cc66:5231 > ff02::16: HBH ICMP6, multicast listener report v2, 1 group record(s), length 28
15:27:40.534749 IP6 fe80::d9ab:2882:cc66:5231 > ff02::16: HBH ICMP6, multicast listener report v2, 1 group record(s), length 28
15:27:40.534861 IP6 fe80::d9ab:2882:cc66:5231 > ff02::16: HBH ICMP6, multicast listener report v2, 1 group record(s), length 28
15:27:40.535257 IP6 fe80::d9ab:2882:cc66:5231 > ff02::16: HBH ICMP6, multicast listener report v2, 1 group record(s), length 28
15:27:40.535297 IP6 fe80::d9ab:2882:cc66:5231 > ff02::16: HBH ICMP6, multicast listener report v2, 1 group record(s), length 28
15:27:40.535299 IP6 fe80::d9ab:2882:cc66:5231 > ff02::16: HBH ICMP6, multicast listener report v2, 1 group record(s), length 28
15:27:40.535348 IP 10.0.0.12 > 224.0.0.252: igmp v2 report 224.0.0.252
15:27:40.535404 IP 10.0.0.12 > 224.0.0.252: igmp v2 report 224.0.0.252
15:27:40.535408 IP 10.0.0.12.62810 > 224.0.0.252.5355: UDP, length 33
15:27:40.535462 IP6 fe80::d9ab:2882:cc66:5231.62810 > ff02::1:3.5355: UDP, length 33
15:27:40.535465 IP 10.0.0.15 > 224.0.0.2: igmp leave 224.0.0.252
15:27:40.535468 IP 10.0.0.12 > 224.0.0.2: igmp leave 224.0.0.252
15:27:40.535509 IP 10.0.0.12 > 224.0.0.2: igmp leave 224.0.0.252
15:27:40.697081 IP 10.0.0.15.62810 > 224.0.0.252.5355: UDP, length 33
15:27:40.705152 IP6 fe80::d9ab:2882:cc66:5231.62810 > ff02::1:3.5355: UDP, length 33
15:27:40.705214 IP6 fe80::d9ab:2882:cc66:5231 > ff02::16: HBH ICMP6, multicast listener report v2, 1 group record(s), length 28
15:27:40.705217 IP 10.0.0.11 > 224.0.0.252: igmp v2 report 224.0.0.252
15:27:40.705244 IP 10.0.0.10 > 224.0.0.252: igmp v2 report 224.0.0.252
15:27:40.705290 IP6 fe80::d9ab:2882:cc66:5231 > ff02::16: HBH ICMP6, multicast listener report v2, 1 group record(s), length 28
15:27:40.762839 IP 10.0.0.12 > 224.0.0.252: igmp v2 report 224.0.0.252
15:27:40.763090 IP6 fe80::d9ab:2882:cc66:5231 > ff02::16: HBH ICMP6, multicast listener report v2, 1 group record(s), length 28
15:27:40.830233 IP 10.0.0.14 > 224.0.0.252: igmp v2 report 224.0.0.252
15:27:40.830241 IP6 fe80::d9ab:2882:cc66:5231 > ff02::16: HBH ICMP6, multicast listener report v2, 1 group record(s), length 28
15:27:40.830302 IP6 fe80::d9ab:2882:cc66:5231 > ff02::16: HBH ICMP6, multicast listener report v2, 1 group record(s), length 28
15:27:40.830304 IP6 fe80::d9ab:2882:cc66:5231 > ff02::16: HBH ICMP6, multicast listener report v2, 1 group record(s), length 28
15:27:40.830306 IP 10.0.0.15 > 224.0.0.252: igmp v2 report 224.0.0.252
15:27:40.830435 IP 10.0.0.2.62816 > 239.255.255.250.1900: UDP, length 173
15:27:40.830481 IP 10.0.0.16 > 224.0.0.252: igmp v2 report 224.0.0.252
15:27:40.917043 IP6 fe80::d9ab:2882:cc66:5231.62810 > ff02::1:3.5355: UDP, length 33
15:27:40.917050 IP 10.0.0.11.62810 > 224.0.0.252.5355: UDP, length 33
15:27:40.917152 IP6 fe80::d9ab:2882:cc66:5231.62810 > ff02::1:3.5355: UDP, length 33
15:27:40.917252 IP 10.0.0.10.62810 > 224.0.0.252.5355: UDP, length 33
15:27:40.917264 IP 10.0.0.4.62816 > 239.255.255.250.1900: UDP, length 173
15:27:40.968969 IP 10.0.0.3.62816 > 239.255.255.250.1900: UDP, length 173
15:27:40.969049 IP 10.0.0.14.62810 > 224.0.0.252.5355: UDP, length 33
15:27:41.038093 IP 10.0.0.15.62810 > 224.0.0.252.5355: UDP, length 33
15:27:41.038244 IP 10.0.0.12.62810 > 224.0.0.252.5355: UDP, length 33
15:27:41.038391 IP6 fe80::d9ab:2882:cc66:5231.62810 > ff02::1:3.5355: UDP, length 33
15:27:41.038540 IP6 fe80::d9ab:2882:cc66:5231.62810 > ff02::1:3.5355: UDP, length 33
15:27:41.038686 IP6 fe80::d9ab:2882:cc66:5231.62810 > ff02::1:3.5355: UDP, length 33
15:27:41.114056 IP6 fe80::d9ab:2882:cc66:5231.62810 > ff02::1:3.5355: UDP, length 33
15:27:41.114204 IP 10.0.0.16.62810 > 224.0.0.252.5355: UDP, length 33
15:27:41.408181 IP 10.0.0.6.62816 > 239.255.255.250.1900: UDP, length 173
15:27:41.408229 IP 10.0.0.7.62816 > 239.255.255.250.1900: UDP, length 173
15:27:42.101833 IP 10.0.0.7.62816 > 239.255.255.250.1900: UDP, length 173
15:27:42.101861 IP 10.0.0.6.62816 > 239.255.255.250.1900: UDP, length 173
15:27:42.167197 IP 10.0.0.2.62816 > 239.255.255.250.1900: UDP, length 173
15:27:42.167332 IP 10.0.0.3.62816 > 239.255.255.250.1900: UDP, length 173
15:27:42.167465 IP 10.0.0.4.62816 > 239.255.255.250.1900: UDP, length 173
15:27:42.668962 IP 10.0.0.6.62816 > 239.255.255.250.1900: UDP, length 173
15:27:42.669021 IP 10.0.0.7.62816 > 239.255.255.250.1900: UDP, length 173
15:27:43.161214 IP 10.0.0.2.62816 > 239.255.255.250.1900: UDP, length 173
15:27:43.161250 IP 10.0.0.3.62816 > 239.255.255.250.1900: UDP, length 173
15:27:43.161275 IP 10.0.0.4.62816 > 239.255.255.250.1900: UDP, length 173
15:27:44.008984 IP 10.0.0.2.62816 > 239.255.255.250.1900: UDP, length 173
15:27:44.053660 IP 10.0.0.3.62816 > 239.255.255.250.1900: UDP, length 173
15:27:44.053663 IP 10.0.0.4.62816 > 239.255.255.250.1900: UDP, length 173
15:27:46.251789 IP 10.0.0.11.62816 > 239.255.255.250.1900: UDP, length 173
15:27:46.251794 IP 10.0.0.10.62816 > 239.255.255.250.1900: UDP, length 173
15:27:46.251850 IP 10.0.0.12.62816 > 239.255.255.250.1900: UDP, length 173
15:27:46.251909 IP 10.0.0.14.62816 > 239.255.255.250.1900: UDP, length 173
15:27:46.306949 IP 10.0.0.16.62816 > 239.255.255.250.1900: UDP, length 173
15:27:46.306995 IP 10.0.0.15.62816 > 239.255.255.250.1900: UDP, length 173
15:27:46.533828 IP 10.0.0.1 > 10.0.0.254: ICMP echo request, id 6551, seq 1, length 64
15:27:46.533901 IP 10.0.0.254 > 10.0.0.1: ICMP echo reply, id 6551, seq 1, length 64
15:27:47.440565 IP 10.0.0.11.62816 > 239.255.255.250.1900: UDP, length 173
15:27:47.440918 IP 10.0.0.10.62816 > 239.255.255.250.1900: UDP, length 173
15:27:47.440978 IP 10.0.0.12.62816 > 239.255.255.250.1900: UDP, length 173
15:27:47.440982 IP 10.0.0.14.62816 > 239.255.255.250.1900: UDP, length 173
15:27:47.440984 IP 10.0.0.16.62816 > 239.255.255.250.1900: UDP, length 173
15:27:47.470241 IP 10.0.0.15.62816 > 239.255.255.250.1900: UDP, length 173
15:27:48.742223 IP 10.0.0.11.62816 > 239.255.255.250.1900: UDP, length 173
15:27:48.742377 IP 10.0.0.10.62816 > 239.255.255.250.1900: UDP, length 173
15:27:48.742528 IP 10.0.0.12.62816 > 239.255.255.250.1900: UDP, length 173
15:27:48.857022 IP 10.0.0.14.62816 > 239.255.255.250.1900: UDP, length 173
15:27:48.857026 IP 10.0.0.16.62816 > 239.255.255.250.1900: UDP, length 173
15:27:48.921938 IP 10.0.0.15.62816 > 239.255.255.250.1900: UDP, length 173
15:27:49.316460 IP 10.1.0.1.67 > 255.255.255.255.68: BOOTP/DHCP, Reply, length 300
15:27:49.450662 IP 10.1.0.1.67 > 255.255.255.255.68: BOOTP/DHCP, Reply, length 300
15:27:49.839424 IP 10.0.0.14.62816 > 239.255.255.250.1900: UDP, length 173
15:27:49.902268 IP 10.0.0.11.62816 > 239.255.255.250.1900: UDP, length 173
15:27:49.903602 IP 10.0.0.10.62816 > 239.255.255.250.1900: UDP, length 173
15:27:49.965461 IP 10.0.0.12.62816 > 239.255.255.250.1900: UDP, length 173
15:27:50.075236 IP 10.0.0.16.62816 > 239.255.255.250.1900: UDP, length 173
15:27:50.075394 IP 10.0.0.15.62816 > 239.255.255.250.1900: UDP, length 173
15:27:50.591162 IP 10.1.0.1.67 > 255.255.255.255.68: BOOTP/DHCP, Reply, length 300
15:27:50.591434 IP 10.1.0.1.67 > 255.255.255.255.68: BOOTP/DHCP, Reply, length 300
15:27:50.591560 IP 10.1.0.1.67 > 255.255.255.255.68: BOOTP/DHCP, Reply, length 300
15:27:51.875338 IP 10.1.110.119.17500 > 10.1.255.255.17500: UDP, length 156
15:27:51.875358 IP 10.1.110.119.17500 > 10.1.255.255.17500: UDP, length 156
15:27:51.875418 IP 10.1.110.119.17500 > 255.255.255.255.17500: UDP, length 156
15:27:51.875445 IP 10.1.110.119.17500 > 255.255.255.255.17500: UDP, length 156
15:27:52.645054 IP 10.1.110.119.17500 > 255.255.255.255.17500: UDP, length 156
15:27:52.645078 IP 10.1.110.119.17500 > 10.1.255.255.17500: UDP, length 156
15:27:52.786006 IP 10.1.110.119.17500 > 255.255.255.255.17500: UDP, length 156
15:27:52.844129 IP 10.1.110.119.17500 > 10.1.255.255.17500: UDP, length 156
15:27:52.844144 IP 10.1.110.119.17500 > 255.255.255.255.17500: UDP, length 156
15:27:52.844196 IP 10.1.110.119.17500 > 10.1.255.255.17500: UDP, length 156
15:27:55.302986 IP 10.0.0.1 > 10.0.0.254: ICMP echo request, id 6557, seq 1, length 64
15:27:55.303038 IP 10.0.0.254 > 10.0.0.1: ICMP echo reply, id 6557, seq 1, length 64
15:27:56.803393 IP 10.1.0.1.67 > 255.255.255.255.68: BOOTP/DHCP, Reply, length 300
15:27:56.913331 IP 10.1.0.1.67 > 255.255.255.255.68: BOOTP/DHCP, Reply, length 300
15:27:56.986271 IP 10.1.0.1.67 > 255.255.255.255.68: BOOTP/DHCP, Reply, length 300
15:27:57.064938 IP 10.1.0.1.67 > 255.255.255.255.68: BOOTP/DHCP, Reply, length 300
15:27:57.064986 IP 10.1.0.1.67 > 255.255.255.255.68: BOOTP/DHCP, Reply, length 300
15:27:57.131547 IP 10.1.0.1.67 > 255.255.255.255.68: BOOTP/DHCP, Reply, length 300
15:27:59.244673 IP 10.1.110.119.17500 > 10.1.255.255.17500: UDP, length 156
15:27:59.245090 IP 10.1.110.119.17500 > 255.255.255.255.17500: UDP, length 156
15:27:59.318572 IP 10.1.110.119.17500 > 10.1.255.255.17500: UDP, length 156
15:27:59.318584 IP 10.1.110.119.17500 > 255.255.255.255.17500: UDP, length 156
15:27:59.318644 IP 10.1.110.119.17500 > 255.255.255.255.17500: UDP, length 156
15:27:59.318867 IP 10.1.110.119.17500 > 10.1.255.255.17500: UDP, length 156
15:27:59.318870 IP 10.1.110.119.17500 > 255.255.255.255.17500: UDP, length 156
15:27:59.405025 IP 10.1.110.119.17500 > 10.1.255.255.17500: UDP, length 156
15:27:59.405038 IP 10.1.110.119.17500 > 255.255.255.255.17500: UDP, length 156
15:27:59.405097 IP 10.1.110.119.17500 > 10.1.255.255.17500: UDP, length 156
15:27:59.405120 IP 10.1.110.119.17500 > 255.255.255.255.17500: UDP, length 156
15:27:59.405122 IP 10.1.110.119.17500 > 10.1.255.255.17500: UDP, length 156
15:28:05.631603 IP 10.0.0.1 > 10.0.0.254: ICMP echo request, id 6563, seq 1, length 64
15:28:05.631651 IP 10.0.0.254 > 10.0.0.1: ICMP echo reply, id 6563, seq 1, length 64
15:28:07.716093 IP 0.0.0.0.68 > 255.255.255.255.67: BOOTP/DHCP, Request from dc:bf:e9:d0:8a:76, length 316
15:28:07.716092 IP 0.0.0.0.68 > 255.255.255.255.67: BOOTP/DHCP, Request from dc:bf:e9:d0:8a:76, length 316
15:28:08.597654 IP 0.0.0.0.68 > 255.255.255.255.67: BOOTP/DHCP, Request from dc:bf:e9:d0:8a:76, length 316
15:28:08.805583 IP 0.0.0.0.68 > 255.255.255.255.67: BOOTP/DHCP, Request from dc:bf:e9:d0:8a:76, length 316
15:28:08.805643 IP 0.0.0.0.68 > 255.255.255.255.67: BOOTP/DHCP, Request from dc:bf:e9:d0:8a:76, length 316
15:28:14.937577 IP 10.0.0.1 > 10.0.0.254: ICMP echo request, id 6569, seq 1, length 64
15:28:14.937628 IP 10.0.0.254 > 10.0.0.1: ICMP echo reply, id 6569, seq 1, length 64
15:28:15.637704 IP 0.0.0.0.68 > 255.255.255.255.67: BOOTP/DHCP, Request from dc:bf:e9:d0:8a:76, length 316
15:28:15.637901 IP 0.0.0.0.68 > 255.255.255.255.67: BOOTP/DHCP, Request from dc:bf:e9:d0:8a:76, length 328
15:28:15.638007 IP 0.0.0.0.68 > 255.255.255.255.67: BOOTP/DHCP, Request from dc:bf:e9:d0:8a:76, length 316
15:28:15.705323 IP 0.0.0.0.68 > 255.255.255.255.67: BOOTP/DHCP, Request from dc:bf:e9:d0:8a:76, length 328
15:28:16.928350 IP 0.0.0.0.68 > 255.255.255.255.67: BOOTP/DHCP, Request from dc:bf:e9:d0:8a:76, length 316
15:28:16.989696 IP 0.0.0.0.68 > 255.255.255.255.67: BOOTP/DHCP, Request from dc:bf:e9:d0:8a:76, length 316
15:28:16.989799 IP 0.0.0.0.68 > 255.255.255.255.67: BOOTP/DHCP, Request from dc:bf:e9:d0:8a:76, length 316
15:28:17.129160 IP 0.0.0.0.68 > 255.255.255.255.67: BOOTP/DHCP, Request from dc:bf:e9:d0:8a:76, length 316
15:28:17.129726 IP 0.0.0.0.68 > 255.255.255.255.67: BOOTP/DHCP, Request from dc:bf:e9:d0:8a:76, length 316
15:28:17.186861 IP 0.0.0.0.68 > 255.255.255.255.67: BOOTP/DHCP, Request from dc:bf:e9:d0:8a:76, length 316
15:28:17.405393 IP 0.0.0.0.68 > 255.255.255.255.67: BOOTP/DHCP, Request from dc:bf:e9:d0:8a:76, length 316
15:28:17.574493 IP 0.0.0.0.68 > 255.255.255.255.67: BOOTP/DHCP, Request from dc:bf:e9:d0:8a:76, length 328
15:28:17.639374 IP 0.0.0.0.68 > 255.255.255.255.67: BOOTP/DHCP, Request from dc:bf:e9:d0:8a:76, length 316
15:28:17.639509 IP 0.0.0.0.68 > 255.255.255.255.67: BOOTP/DHCP, Request from dc:bf:e9:d0:8a:76, length 316
15:28:17.736594 IP 0.0.0.0.68 > 255.255.255.255.67: BOOTP/DHCP, Request from dc:bf:e9:d0:8a:76, length 328
15:28:17.736711 IP 0.0.0.0.68 > 255.255.255.255.67: BOOTP/DHCP, Request from dc:bf:e9:d0:8a:76, length 328
15:28:25.384584 IP 10.0.0.1 > 10.0.0.254: ICMP echo request, id 6576, seq 1, length 64
15:28:25.384648 IP 10.0.0.254 > 10.0.0.1: ICMP echo reply, id 6576, seq 1, length 64
15:28:26.377321 IP 0.0.0.0.68 > 255.255.255.255.67: BOOTP/DHCP, Request from dc:bf:e9:d0:8a:76, length 316
15:28:26.448449 IP 0.0.0.0.68 > 255.255.255.255.67: BOOTP/DHCP, Request from dc:bf:e9:d0:8a:76, length 328
15:28:26.448573 IP 0.0.0.0.68 > 255.255.255.255.67: BOOTP/DHCP, Request from dc:bf:e9:d0:8a:76, length 316
15:28:26.448650 IP 0.0.0.0.68 > 255.255.255.255.67: BOOTP/DHCP, Request from dc:bf:e9:d0:8a:76, length 328
15:28:26.509819 IP 0.0.0.0.68 > 255.255.255.255.67: BOOTP/DHCP, Request from dc:bf:e9:d0:8a:76, length 316
15:28:26.685086 IP 0.0.0.0.68 > 255.255.255.255.67: BOOTP/DHCP, Request from dc:bf:e9:d0:8a:76, length 316
15:28:26.685089 IP 0.0.0.0.68 > 255.255.255.255.67: BOOTP/DHCP, Request from dc:bf:e9:d0:8a:76, length 328
15:28:26.685129 IP 0.0.0.0.68 > 255.255.255.255.67: BOOTP/DHCP, Request from dc:bf:e9:d0:8a:76, length 328
15:28:26.685222 IP 0.0.0.0.68 > 255.255.255.255.67: BOOTP/DHCP, Request from dc:bf:e9:d0:8a:76, length 316
15:28:26.791890 IP 0.0.0.0.68 > 255.255.255.255.67: BOOTP/DHCP, Request from dc:bf:e9:d0:8a:76, length 316
15:28:26.861976 IP 0.0.0.0.68 > 255.255.255.255.67: BOOTP/DHCP, Request from dc:bf:e9:d0:8a:76, length 328
15:28:26.862028 IP 0.0.0.0.68 > 255.255.255.255.67: BOOTP/DHCP, Request from dc:bf:e9:d0:8a:76, length 328
15:28:34.381581 IP 10.1.110.119.17500 > 10.1.255.255.17500: UDP, length 156
15:28:34.456015 IP 10.1.110.119.17500 > 255.255.255.255.17500: UDP, length 156
15:28:34.456125 IP 10.1.110.119.17500 > 255.255.255.255.17500: UDP, length 156
15:28:34.456128 IP 10.1.110.119.17500 > 10.1.255.255.17500: UDP, length 156
15:28:36.782086 IP 10.1.110.119.17500 > 255.255.255.255.17500: UDP, length 156
15:28:36.782188 IP 10.1.110.119.17500 > 10.1.255.255.17500: UDP, length 156
15:28:36.854757 IP 10.1.110.119.17500 > 255.255.255.255.17500: UDP, length 156
15:28:36.854801 IP 10.1.110.119.17500 > 10.1.255.255.17500: UDP, length 156
15:28:37.057215 IP 10.1.110.119.17500 > 255.255.255.255.17500: UDP, length 156
15:28:37.057316 IP 10.1.110.119.17500 > 10.1.255.255.17500: UDP, length 156
15:28:38.653560 IP 10.0.0.1 > 10.0.0.254: ICMP echo request, id 6586, seq 1, length 64
15:28:38.653610 IP 10.0.0.254 > 10.0.0.1: ICMP echo reply, id 6586, seq 1, length 64
15:28:45.994985 IP 10.0.0.13.58575 > 8.8.8.8.53: 40990+ A? bcn.pool.minergate.com. (40)
15:28:45.995030 IP 10.0.0.13.58575 > 8.8.8.8.53: 58936+ AAAA? bcn.pool.minergate.com. (40)
15:28:46.036038 IP 10.0.0.5.44533 > 8.8.8.8.53: 1220+ A? bcn.pool.minergate.com. (40)
15:28:46.036079 IP 10.0.0.5.44533 > 8.8.8.8.53: 35036+ AAAA? bcn.pool.minergate.com. (40)
15:28:46.047369 IP 8.8.8.8.53 > 10.0.0.13.58575: 40990 5/0/0 A 176.9.2.145, A 176.9.147.78, A 94.130.9.194, A 78.46.49.212, A 46.4.119.208 (120)
15:28:46.047413 IP 8.8.8.8.53 > 10.0.0.13.58575: 58936 0/1/0 (121)
15:28:46.131830 IP 8.8.8.8.53 > 10.0.0.5.44533: 35036 0/1/0 (121)
15:28:46.134526 IP 8.8.8.8.53 > 10.0.0.5.44533: 1220 5/0/0 A 176.9.2.145, A 176.9.147.78, A 94.130.9.194, A 78.46.49.212, A 46.4.119.208 (120)
15:28:46.134805 IP 10.0.0.5.50908 > 78.46.49.212.45550: Flags [S], seq 2817017592, win 29200, options [mss 1460,sackOK,TS val 3427923368 ecr 0,nop,wscale 9], length 0
15:28:46.379942 IP 78.46.49.212.45550 > 10.0.0.5.50908: Flags [S.], seq 474327751, ack 2817017593, win 65535, options [mss 1460,sackOK,TS val 1977362993 ecr 3427923368,nop,wscale 13], length 0
15:28:46.380162 IP 10.0.0.5.50908 > 78.46.49.212.45550: Flags [.], ack 1, win 58, options [nop,nop,TS val 3427923614 ecr 1977362993], length 0
15:28:46.380169 IP 10.0.0.5.50908 > 78.46.49.212.45550: Flags [P.], seq 1:239, ack 1, win 58, options [nop,nop,TS val 3427923614 ecr 1977362993], length 238
15:28:46.625551 IP 78.46.49.212.45550 > 10.0.0.5.50908: Flags [.], ack 239, win 43, options [nop,nop,TS val 1977363239 ecr 3427923614], length 0
15:28:47.406699 IP 10.1.110.119.17500 > 10.1.255.255.17500: UDP, length 156
15:28:47.453594 IP 10.1.110.119.17500 > 255.255.255.255.17500: UDP, length 156
15:28:47.519646 IP 10.1.110.119.17500 > 255.255.255.255.17500: UDP, length 156
15:28:47.519696 IP 10.1.110.119.17500 > 10.1.255.255.17500: UDP, length 156
15:28:47.606734 IP 10.1.110.119.17500 > 255.255.255.255.17500: UDP, length 156
15:28:47.639426 IP 10.1.110.119.17500 > 10.1.255.255.17500: UDP, length 156
15:28:47.722098 IP 10.1.110.119.17500 > 255.255.255.255.17500: UDP, length 156
15:28:47.722105 IP 10.1.110.119.17500 > 10.1.255.255.17500: UDP, length 156
15:28:47.722188 IP 10.1.110.119.17500 > 255.255.255.255.17500: UDP, length 156
15:28:47.722190 IP 10.1.110.119.17500 > 10.1.255.255.17500: UDP, length 156
15:28:47.775080 IP 10.1.110.119.17500 > 10.1.255.255.17500: UDP, length 156
15:28:47.828435 IP 10.1.110.119.17500 > 255.255.255.255.17500: UDP, length 156
15:29:11.348545 IP 10.1.110.119.17500 > 255.255.255.255.17500: UDP, length 156
15:29:11.348689 IP 10.1.110.119.17500 > 10.1.255.255.17500: UDP, length 156
15:29:11.348688 IP 10.1.110.119.17500 > 255.255.255.255.17500: UDP, length 156
15:29:11.348825 IP 10.1.110.119.17500 > 10.1.255.255.17500: UDP, length 156
15:29:12.041735 IP 10.0.0.5.48999 > 8.8.8.8.53: 50243+ A? bcn.pool.minergate.com. (40)
15:29:12.041793 IP 10.0.0.5.48999 > 8.8.8.8.53: 42587+ AAAA? bcn.pool.minergate.com. (40)
15:29:12.070070 IP 10.0.0.8.37451 > 8.8.8.8.53: 39087+ A? bcn.pool.minergate.com. (40)
15:29:12.070096 IP 10.0.0.8.37451 > 8.8.8.8.53: 42693+ AAAA? bcn.pool.minergate.com. (40)
15:29:12.071628 IP 8.8.8.8.53 > 10.0.0.8.37451: 42693 0/1/0 (121)
15:29:12.095600 IP 8.8.8.8.53 > 10.0.0.5.48999: 50243 5/0/0 A 94.130.9.194, A 176.9.147.78, A 176.9.2.145, A 78.46.49.212, A 46.4.119.208 (120)
15:29:12.124085 IP 8.8.8.8.53 > 10.0.0.8.37451: 39087 5/0/0 A 46.4.119.208, A 176.9.2.145, A 176.9.147.78, A 78.46.49.212, A 94.130.9.194 (120)
15:29:12.124456 IP 10.0.0.8.50826 > 176.9.2.145.45550: Flags [S], seq 3936619429, win 29200, options [mss 1460,sackOK,TS val 3895724996 ecr 0,nop,wscale 9], length 0
15:29:12.138733 IP 8.8.8.8.53 > 10.0.0.5.48999: 42587 0/1/0 (121)
15:29:12.375746 IP 176.9.2.145.45550 > 10.0.0.8.50826: Flags [S.], seq 3831314527, ack 3936619430, win 65535, options [mss 1460,sackOK,TS val 751963839 ecr 3895724996,nop,wscale 13], length 0
15:29:12.919615 IP 10.1.110.119.17500 > 255.255.255.255.17500: UDP, length 156
15:29:12.919753 IP 10.1.110.119.17500 > 10.1.255.255.17500: UDP, length 156
15:29:12.920460 IP 10.1.110.119.17500 > 10.1.255.255.17500: UDP, length 156
15:29:12.979395 IP 10.1.110.119.17500 > 255.255.255.255.17500: UDP, length 156
15:29:12.979700 IP 10.1.110.119.17500 > 255.255.255.255.17500: UDP, length 156
15:29:12.979840 IP 10.1.110.119.17500 > 10.1.255.255.17500: UDP, length 156
15:29:13.129380 IP 10.0.0.8.50826 > 176.9.2.145.45550: Flags [S], seq 3936619429, win 29200, options [mss 1460,sackOK,TS val 3895726001 ecr 0,nop,wscale 9], length 0
15:29:13.380152 IP 176.9.2.145.45550 > 10.0.0.8.50826: Flags [S.], seq 3831314527, ack 3936619430, win 65535, options [mss 1460,sackOK,TS val 751964844 ecr 3895724996,nop,wscale 13], length 0
15:29:14.394837 IP 176.9.2.145.45550 > 10.0.0.8.50826: Flags [S.], seq 3831314527, ack 3936619430, win 65535, options [mss 1460,sackOK,TS val 751965858 ecr 3895724996,nop,wscale 13], length 0
15:29:15.145349 IP 10.0.0.8.50826 > 176.9.2.145.45550: Flags [S], seq 3936619429, win 29200, options [mss 1460,sackOK,TS val 3895728017 ecr 0,nop,wscale 9], length 0
15:29:15.396360 IP 176.9.2.145.45550 > 10.0.0.8.50826: Flags [S.], seq 3831314527, ack 3936619430, win 65535, options [mss 1460,sackOK,TS val 751966860 ecr 3895724996,nop,wscale 13], length 0
15:29:17.402530 IP 176.9.2.145.45550 > 10.0.0.8.50826: Flags [S.], seq 3831314527, ack 3936619430, win 65535, options [mss 1460,sackOK,TS val 751968866 ecr 3895724996,nop,wscale 13], length 0
15:29:19.365386 IP 10.0.0.8.50826 > 176.9.2.145.45550: Flags [S], seq 3936619429, win 29200, options [mss 1460,sackOK,TS val 3895732237 ecr 0,nop,wscale 9], length 0
15:29:19.616067 IP 176.9.2.145.45550 > 10.0.0.8.50826: Flags [S.], seq 3831314527, ack 3936619430, win 65535, options [mss 1460,sackOK,TS val 751971080 ecr 3895724996,nop,wscale 13], length 0
15:29:23.643219 IP 176.9.2.145.45550 > 10.0.0.8.50826: Flags [S.], seq 3831314527, ack 3936619430, win 65535, options [mss 1460,sackOK,TS val 751975106 ecr 3895724996,nop,wscale 13], length 0
15:29:26.413789 IP 10.1.110.119.17500 > 255.255.255.255.17500: UDP, length 156
15:29:26.413932 IP 10.1.110.119.17500 > 10.1.255.255.17500: UDP, length 156
15:29:26.414126 IP 10.1.110.119.17500 > 255.255.255.255.17500: UDP, length 156
15:29:26.414290 IP 10.1.110.119.17500 > 10.1.255.255.17500: UDP, length 156
15:29:26.414495 IP 10.1.110.119.17500 > 255.255.255.255.17500: UDP, length 156
15:29:26.414621 IP 10.1.110.119.17500 > 10.1.255.255.17500: UDP, length 156
15:29:26.475418 IP 10.1.110.119.17500 > 255.255.255.255.17500: UDP, length 156
15:29:26.475539 IP 10.1.110.119.17500 > 255.255.255.255.17500: UDP, length 156
15:29:26.475793 IP 10.1.110.119.17500 > 255.255.255.255.17500: UDP, length 156
15:29:26.531941 IP 10.1.110.119.17500 > 10.1.255.255.17500: UDP, length 156
15:29:26.532071 IP 10.1.110.119.17500 > 10.1.255.255.17500: UDP, length 156
15:29:26.532204 IP 10.1.110.119.17500 > 10.1.255.255.17500: UDP, length 156
15:29:26.970184 IP 176.9.2.145.45550 > 10.0.0.5.48770: Flags [P.], seq 0:284, ack 1, win 43, options [nop,nop,TS val 751978434 ecr 3233037389], length 284
15:29:27.561405 IP 10.0.0.8.50826 > 176.9.2.145.45550: Flags [S], seq 3936619429, win 29200, options [mss 1460,sackOK,TS val 3895740433 ecr 0,nop,wscale 9], length 0
15:29:27.812243 IP 176.9.2.145.45550 > 10.0.0.8.50826: Flags [S.], seq 3831314527, ack 3936619430, win 65535, options [mss 1460,sackOK,TS val 751979276 ecr 3895724996,nop,wscale 13], length 0
15:29:30.034844 IP 0.0.0.0 > 224.0.0.1: igmp query v2
15:29:30.034871 IP 0.0.0.0 > 224.0.0.1: igmp query v2
15:29:30.228536 IP 10.0.0.7 > 239.255.255.250: igmp v2 report 239.255.255.250
15:29:30.228746 IP 10.0.0.6 > 239.255.255.250: igmp v2 report 239.255.255.250
15:29:31.353763 IP 0.0.0.0 > 224.0.0.1: igmp query v2
15:29:31.354177 IP 10.0.0.6 > 224.0.0.251: igmp v2 report 224.0.0.251
15:29:31.354196 IP 10.0.0.7 > 224.0.0.251: igmp v2 report 224.0.0.251
15:29:31.431021 IP 0.0.0.0 > 224.0.0.1: igmp query v2
15:29:31.431024 IP 10.0.0.2 > 239.255.255.250: igmp v2 report 239.255.255.250
15:29:31.431029 IP 0.0.0.0 > 224.0.0.1: igmp query v2
15:29:31.492506 IP 10.0.0.3 > 239.255.255.250: igmp v2 report 239.255.255.250
15:29:31.492557 IP 10.0.0.4 > 239.255.255.250: igmp v2 report 239.255.255.250
15:29:32.656974 IP 10.0.0.2 > 224.0.0.251: igmp v2 report 224.0.0.251
15:29:32.721998 IP 10.0.0.3 > 224.0.0.251: igmp v2 report 224.0.0.251
15:29:32.722043 IP 10.0.0.4 > 224.0.0.251: igmp v2 report 224.0.0.251
15:29:35.161744 IP 176.9.2.145.45550 > 10.0.0.8.50784: Flags [P.], seq 0:284, ack 1, win 43, options [nop,nop,TS val 751986627 ecr 3895307509], length 284
15:29:35.930697 IP 176.9.2.145.45550 > 10.0.0.8.50826: Flags [S.], seq 3831314527, ack 3936619430, win 65535, options [mss 1460,sackOK,TS val 751987395 ecr 3895724996,nop,wscale 13], length 0
15:29:38.518401 IP 10.0.0.6 > 224.0.0.252: igmp v2 report 224.0.0.252
15:29:38.566138 IP 10.0.0.7 > 224.0.0.252: igmp v2 report 224.0.0.252
15:29:39.032186 IP 10.0.0.9.57939 > 8.8.8.8.53: 53764+ A? bcn.pool.minergate.com. (40)
15:29:39.032212 IP 10.0.0.9.57939 > 8.8.8.8.53: 49180+ AAAA? bcn.pool.minergate.com. (40)
15:29:39.084408 IP 8.8.8.8.53 > 10.0.0.9.57939: 53764 5/0/0 A 176.9.147.78, A 78.46.49.212, A 46.4.119.208, A 176.9.2.145, A 94.130.9.194 (120)
15:29:39.088726 IP 8.8.8.8.53 > 10.0.0.9.57939: 49180 0/1/0 (121)
15:29:39.088992 IP 10.0.0.9.46102 > 46.4.119.208.45550: Flags [S], seq 4087104132, win 29200, options [mss 1460,sackOK,TS val 4025998951 ecr 0,nop,wscale 9], length 0
15:29:39.259892 IP 176.9.2.145.45550 > 10.0.0.9.53914: Flags [P.], seq 0:284, ack 1, win 43, options [nop,nop,TS val 751990723 ecr 1114192071], length 284
15:29:39.333451 IP 46.4.119.208.45550 > 10.0.0.9.46102: Flags [S.], seq 849473764, ack 4087104133, win 65535, options [mss 1460,sackOK,TS val 3816587974 ecr 4025998951,nop,wscale 13], length 0
15:29:39.333639 IP 10.0.0.9.46102 > 46.4.119.208.45550: Flags [.], ack 1, win 58, options [nop,nop,TS val 4025999196 ecr 3816587974], length 0
15:29:39.333686 IP 10.0.0.9.46102 > 46.4.119.208.45550: Flags [P.], seq 1:239, ack 1, win 58, options [nop,nop,TS val 4025999196 ecr 3816587974], length 238
15:29:39.577866 IP 46.4.119.208.45550 > 10.0.0.9.46102: Flags [.], ack 239, win 43, options [nop,nop,TS val 3816588219 ecr 4025999196], length 0
15:29:39.644383 IP 10.0.0.2 > 224.0.0.252: igmp v2 report 224.0.0.252
15:29:39.644532 IP 10.0.0.3 > 224.0.0.252: igmp v2 report 224.0.0.252
15:29:39.716142 IP 10.0.0.4 > 224.0.0.252: igmp v2 report 224.0.0.252
15:29:42.061522 IP 10.0.0.1 > 10.0.0.254: ICMP echo request, id 6598, seq 1, length 64
15:29:42.061548 IP 10.0.0.254 > 10.0.0.1: ICMP echo reply, id 6598, seq 1, length 64
15:29:43.356993 IP 10.1.110.119.17500 > 255.255.255.255.17500: UDP, length 156
15:29:43.419932 IP 10.1.110.119.17500 > 10.1.255.255.17500: UDP, length 156
15:29:43.420218 IP 10.1.110.119.17500 > 255.255.255.255.17500: UDP, length 156
15:29:43.420374 IP 10.1.110.119.17500 > 10.1.255.255.17500: UDP, length 156
15:29:44.573165 IP 10.1.110.119.17500 > 10.1.255.255.17500: UDP, length 156
