11:32:45.087545 IP 10.0.0.1.38508 > static.145.2.9.176.clients.your-server.de.45550: Flags [F.], seq 3317577680, ack 44147472, win 60, options [nop,nop,TS val 1365812111 ecr 824166515], length 0
11:32:45.332775 IP static.145.2.9.176.clients.your-server.de.45550 > 10.0.0.1.38508: Flags [F.], seq 1, ack 1, win 43, options [nop,nop,TS val 824177762 ecr 1365812111], length 0
11:32:45.333661 IP 10.0.0.1.38508 > static.145.2.9.176.clients.your-server.de.45550: Flags [.], ack 2, win 60, options [nop,nop,TS val 1365812358 ecr 824177762], length 0
11:33:24.250266 IP 10.0.0.5.45616 > google-public-dns-a.google.com.domain: 25160+ A? bcn.pool.minergate.com. (40)
11:33:24.250289 IP 10.0.0.5.45616 > google-public-dns-a.google.com.domain: 34410+ AAAA? bcn.pool.minergate.com. (40)
11:33:24.283924 IP 10.0.0.8.39036 > google-public-dns-a.google.com.domain: 15909+ A? bcn.pool.minergate.com. (40)
11:33:24.283941 IP 10.0.0.8.39036 > google-public-dns-a.google.com.domain: 24118+ AAAA? bcn.pool.minergate.com. (40)
11:33:24.307852 IP 10.0.0.13.47684 > google-public-dns-a.google.com.domain: 50761+ A? bcn.pool.minergate.com. (40)
11:33:24.307898 IP 10.0.0.13.47684 > google-public-dns-a.google.com.domain: 10840+ AAAA? bcn.pool.minergate.com. (40)
11:33:24.315656 IP google-public-dns-a.google.com.domain > 10.0.0.5.45616: 34410 0/1/0 (121)
11:33:24.316051 IP 10.0.0.9.35252 > google-public-dns-a.google.com.domain: 4750+ A? bcn.pool.minergate.com. (40)
11:33:24.316099 IP 10.0.0.9.35252 > google-public-dns-a.google.com.domain: 15008+ AAAA? bcn.pool.minergate.com. (40)
11:33:24.337588 IP google-public-dns-a.google.com.domain > 10.0.0.8.39036: 15909 5/0/0 A 94.130.9.194, A 176.9.2.145, A 46.4.119.208, A 78.46.49.212, A 176.9.147.78 (120)
11:33:24.355665 IP google-public-dns-a.google.com.domain > 10.0.0.5.45616: 25160 5/0/0 A 46.4.119.208, A 176.9.2.145, A 176.9.147.78, A 94.130.9.194, A 78.46.49.212 (120)
11:33:24.361518 IP google-public-dns-a.google.com.domain > 10.0.0.13.47684: 10840 0/1/0 (121)
11:33:24.365531 IP google-public-dns-a.google.com.domain > 10.0.0.13.47684: 50761 5/0/0 A 176.9.2.145, A 176.9.147.78, A 46.4.119.208, A 78.46.49.212, A 94.130.9.194 (120)
11:33:24.367143 IP 10.0.0.5.32794 > static.78.147.9.176.clients.your-server.de.45550: Flags [S], seq 1317286399, win 29200, options [mss 1460,sackOK,TS val 240444104 ecr 0,nop,wscale 9], length 0
11:33:24.367260 IP 10.0.0.13.57474 > static.212.49.46.78.clients.your-server.de.45550: Flags [S], seq 693277637, win 29200, options [mss 1460,sackOK,TS val 2809758773 ecr 0,nop,wscale 9], length 0
11:33:24.374984 IP google-public-dns-a.google.com.domain > 10.0.0.9.35252: 4750 5/0/0 A 94.130.9.194, A 176.9.2.145, A 46.4.119.208, A 78.46.49.212, A 176.9.147.78 (120)
11:33:24.382138 IP google-public-dns-a.google.com.domain > 10.0.0.8.39036: 24118 0/1/0 (121)
11:33:24.382724 IP 10.0.0.8.52950 > static.212.49.46.78.clients.your-server.de.45550: Flags [S], seq 3280570390, win 29200, options [mss 1460,sackOK,TS val 879441166 ecr 0,nop,wscale 9], length 0
11:33:24.416860 IP google-public-dns-a.google.com.domain > 10.0.0.9.35252: 15008 0/1/0 (121)
11:33:24.423316 IP 10.0.0.9.44474 > static.212.49.46.78.clients.your-server.de.45550: Flags [S], seq 2451389346, win 29200, options [mss 1460,sackOK,TS val 340336145 ecr 0,nop,wscale 9], length 0
11:33:24.612103 IP static.78.147.9.176.clients.your-server.de.45550 > 10.0.0.5.32794: Flags [S.], seq 4118568021, ack 1317286400, win 65535, options [mss 1460,sackOK,TS val 3300472113 ecr 240444104,nop,wscale 13], length 0
11:33:24.612325 IP 10.0.0.5.32794 > static.78.147.9.176.clients.your-server.de.45550: Flags [.], ack 1, win 58, options [nop,nop,TS val 240444349 ecr 3300472113], length 0
11:33:24.614842 IP static.212.49.46.78.clients.your-server.de.45550 > 10.0.0.13.57474: Flags [S.], seq 3972971358, ack 693277638, win 65535, options [mss 1460,sackOK,TS val 2049641221 ecr 2809758773,nop,wscale 13], length 0
11:33:24.614891 IP 10.0.0.5.32794 > static.78.147.9.176.clients.your-server.de.45550: Flags [P.], seq 1:239, ack 1, win 58, options [nop,nop,TS val 240444352 ecr 3300472113], length 238
11:33:24.615014 IP 10.0.0.13.57474 > static.212.49.46.78.clients.your-server.de.45550: Flags [.], ack 1, win 58, options [nop,nop,TS val 2809759021 ecr 2049641221], length 0
11:33:24.618899 IP 10.0.0.13.57474 > static.212.49.46.78.clients.your-server.de.45550: Flags [P.], seq 1:239, ack 1, win 58, options [nop,nop,TS val 2809759025 ecr 2049641221], length 238
11:33:24.631440 IP static.212.49.46.78.clients.your-server.de.45550 > 10.0.0.8.52950: Flags [S.], seq 2855074717, ack 3280570391, win 65535, options [mss 1460,sackOK,TS val 2049641239 ecr 879441166,nop,wscale 13], length 0
11:33:24.631639 IP 10.0.0.8.52950 > static.212.49.46.78.clients.your-server.de.45550: Flags [.], ack 1, win 58, options [nop,nop,TS val 879441415 ecr 2049641239], length 0
11:33:24.631744 IP 10.0.0.8.52950 > static.212.49.46.78.clients.your-server.de.45550: Flags [P.], seq 1:239, ack 1, win 58, options [nop,nop,TS val 879441415 ecr 2049641239], length 238
11:33:24.672472 IP static.212.49.46.78.clients.your-server.de.45550 > 10.0.0.9.44474: Flags [S.], seq 2291228443, ack 2451389347, win 65535, options [mss 1460,sackOK,TS val 2049641275 ecr 340336145,nop,wscale 13], length 0
11:33:24.672688 IP 10.0.0.9.44474 > static.212.49.46.78.clients.your-server.de.45550: Flags [.], ack 1, win 58, options [nop,nop,TS val 340336395 ecr 2049641275], length 0
11:33:24.672794 IP 10.0.0.9.44474 > static.212.49.46.78.clients.your-server.de.45550: Flags [P.], seq 1:239, ack 1, win 58, options [nop,nop,TS val 340336395 ecr 2049641275], length 238
11:33:24.859687 IP static.78.147.9.176.clients.your-server.de.45550 > 10.0.0.5.32794: Flags [.], ack 239, win 43, options [nop,nop,TS val 3300472361 ecr 240444352], length 0
11:33:24.866364 IP static.212.49.46.78.clients.your-server.de.45550 > 10.0.0.13.57474: Flags [.], ack 239, win 43, options [nop,nop,TS val 2049641473 ecr 2809759025], length 0
11:33:24.880222 IP static.212.49.46.78.clients.your-server.de.45550 > 10.0.0.8.52950: Flags [.], ack 239, win 43, options [nop,nop,TS val 2049641487 ecr 879441415], length 0
11:33:24.922098 IP static.212.49.46.78.clients.your-server.de.45550 > 10.0.0.9.44474: Flags [.], ack 239, win 43, options [nop,nop,TS val 2049641524 ecr 340336395], length 0
11:33:32.785711 IP6 fe80::8c78:46ff:fe59:4fdd > ip6-allrouters: ICMP6, router solicitation, length 16
11:33:40.116679 IP 0.0.0.0 > all-systems.mcast.net: igmp query v2 [max resp time 10] [gaddr 239.255.255.250]
11:33:40.270027 IP 0.0.0.0 > all-systems.mcast.net: igmp query v2 [max resp time 10] [gaddr 239.255.255.250]
11:33:40.270487 IP 0.0.0.0 > all-systems.mcast.net: igmp query v2 [max resp time 10] [gaddr 239.255.255.250]
11:33:40.368977 IP 0.0.0.0 > all-systems.mcast.net: igmp query v2 [max resp time 10] [gaddr 239.255.255.250]
11:33:40.369519 IP 0.0.0.0 > all-systems.mcast.net: igmp query v2 [max resp time 10] [gaddr 239.255.255.250]
11:33:40.448158 IP 0.0.0.0 > all-systems.mcast.net: igmp query v2 [max resp time 10] [gaddr 239.255.255.250]
11:33:40.448221 IP 0.0.0.0 > all-systems.mcast.net: igmp query v2 [max resp time 10] [gaddr 239.255.255.250]
11:33:40.448445 IP 0.0.0.0 > all-systems.mcast.net: igmp query v2 [max resp time 10] [gaddr 239.255.255.250]
11:33:40.680292 IP 10.0.0.6 > 239.255.255.250: igmp v2 report 239.255.255.250
11:33:40.680477 IP 0.0.0.0 > all-systems.mcast.net: igmp query v2 [max resp time 10] [gaddr 239.255.255.250]
11:33:40.768168 IP 10.0.0.7 > 239.255.255.250: igmp v2 report 239.255.255.250
11:33:40.768445 IP 10.0.0.12 > 239.255.255.250: igmp v2 report 239.255.255.250
11:33:40.854801 IP 0.0.0.0 > all-systems.mcast.net: igmp query v2 [max resp time 10] [gaddr 239.255.255.250]
11:33:40.854913 IP 0.0.0.0 > all-systems.mcast.net: igmp query v2 [max resp time 10] [gaddr 239.255.255.250]
11:33:40.856010 IP 10.0.0.15 > 239.255.255.250: igmp v2 report 239.255.255.250
11:33:40.977352 IP 10.0.0.11 > 239.255.255.250: igmp v2 report 239.255.255.250
11:33:41.084073 IP 10.0.0.14 > 239.255.255.250: igmp v2 report 239.255.255.250
11:33:41.146599 IP 10.0.0.10 > 239.255.255.250: igmp v2 report 239.255.255.250
11:33:41.261021 IP 10.0.0.16 > 239.255.255.250: igmp v2 report 239.255.255.250
11:33:41.486417 IP 10.0.0.2 > 239.255.255.250: igmp v2 report 239.255.255.250
11:33:41.486871 IP 10.0.0.3 > 239.255.255.250: igmp v2 report 239.255.255.250
11:33:41.571773 IP 10.0.0.4 > 239.255.255.250: igmp v2 report 239.255.255.250
11:33:43.203514 IP 0.0.0.0 > all-systems.mcast.net: igmp query v2
11:33:43.206869 IP 0.0.0.0 > all-systems.mcast.net: igmp query v2
11:33:43.572040 IP 10.0.0.6 > 224.0.0.252: igmp v2 report 224.0.0.252
11:33:43.572270 IP 10.0.0.6 > 224.0.0.251: igmp v2 report 224.0.0.251
11:33:43.680212 IP 10.0.0.7 > 224.0.0.251: igmp v2 report 224.0.0.251
11:33:43.680346 IP 0.0.0.0 > all-systems.mcast.net: igmp query v2
11:33:43.680650 IP 0.0.0.0 > all-systems.mcast.net: igmp query v2
11:33:43.680767 IP 0.0.0.0 > all-systems.mcast.net: igmp query v2
11:33:43.681034 IP 0.0.0.0 > all-systems.mcast.net: igmp query v2
11:33:43.752657 IP 10.0.0.7 > 224.0.0.252: igmp v2 report 224.0.0.252
11:33:43.752751 IP 0.0.0.0 > all-systems.mcast.net: igmp query v2
11:33:43.752876 IP 0.0.0.0 > all-systems.mcast.net: igmp query v2
11:33:43.883736 IP 0.0.0.0 > all-systems.mcast.net: igmp query v2
11:33:43.883900 IP 0.0.0.0 > all-systems.mcast.net: igmp query v2
11:33:43.884061 IP 0.0.0.0 > all-systems.mcast.net: igmp query v2
11:33:44.068554 IP 10.0.0.12 > 224.0.0.252: igmp v2 report 224.0.0.252
11:33:44.068558 IP 10.0.0.11 > 224.0.0.252: igmp v2 report 224.0.0.252
11:33:44.068668 IP 10.0.0.12 > 224.0.0.251: igmp v2 report 224.0.0.251
11:33:44.068739 IP 10.0.0.11 > 224.0.0.251: igmp v2 report 224.0.0.251
11:33:44.068905 IP 10.0.0.14 > 224.0.0.252: igmp v2 report 224.0.0.252
11:33:44.068907 IP 10.0.0.14 > 224.0.0.251: igmp v2 report 224.0.0.251
11:33:44.068966 IP 10.0.0.15 > 224.0.0.252: igmp v2 report 224.0.0.252
11:33:44.068969 IP 10.0.0.15 > 224.0.0.251: igmp v2 report 224.0.0.251
11:33:44.198737 IP 10.0.0.2 > 224.0.0.252: igmp v2 report 224.0.0.252
11:33:44.198783 IP 10.0.0.2 > 224.0.0.251: igmp v2 report 224.0.0.251
11:33:44.198787 IP 10.0.0.10 > 224.0.0.251: igmp v2 report 224.0.0.251
11:33:44.198788 IP 10.0.0.10 > 224.0.0.252: igmp v2 report 224.0.0.252
11:33:44.268025 IP 10.0.0.16 > 224.0.0.252: igmp v2 report 224.0.0.252
11:33:44.268156 IP 10.0.0.16 > 224.0.0.251: igmp v2 report 224.0.0.251
11:33:44.268555 IP 10.0.0.4 > 224.0.0.251: igmp v2 report 224.0.0.251
11:33:44.268689 IP 10.0.0.4 > 224.0.0.252: igmp v2 report 224.0.0.252
11:33:44.268841 IP 10.0.0.3 > 224.0.0.252: igmp v2 report 224.0.0.252
11:33:44.268987 IP 10.0.0.3 > 224.0.0.251: igmp v2 report 224.0.0.251
11:33:45.204661 IP 10.0.0.5.32794 > static.78.147.9.176.clients.your-server.de.45550: Flags [F.], seq 239, ack 1, win 58, options [nop,nop,TS val 240464942 ecr 3300472361], length 0
11:33:45.219050 IP 10.0.0.8.52950 > static.212.49.46.78.clients.your-server.de.45550: Flags [F.], seq 239, ack 1, win 58, options [nop,nop,TS val 879462002 ecr 2049641487], length 0
11:33:45.221090 IP 10.0.0.13.57474 > static.212.49.46.78.clients.your-server.de.45550: Flags [F.], seq 239, ack 1, win 58, options [nop,nop,TS val 2809779627 ecr 2049641473], length 0
11:33:45.235040 IP 10.0.0.9.44474 > static.212.49.46.78.clients.your-server.de.45550: Flags [F.], seq 239, ack 1, win 58, options [nop,nop,TS val 340356957 ecr 2049641524], length 0
11:33:45.344260 IP6 fe80::b847:98ff:fe2c:7487 > ip6-allrouters: ICMP6, router solicitation, length 16
11:33:45.449420 IP static.78.147.9.176.clients.your-server.de.45550 > 10.0.0.5.32794: Flags [F.], seq 1, ack 240, win 43, options [nop,nop,TS val 3300492951 ecr 240464942], length 0
11:33:45.449878 IP 10.0.0.5.32794 > static.78.147.9.176.clients.your-server.de.45550: Flags [.], ack 2, win 58, options [nop,nop,TS val 240465188 ecr 3300492951], length 0
11:33:45.467641 IP static.212.49.46.78.clients.your-server.de.45550 > 10.0.0.8.52950: Flags [F.], seq 1, ack 240, win 43, options [nop,nop,TS val 2049662075 ecr 879462002], length 0
11:33:45.468129 IP 10.0.0.8.52950 > static.212.49.46.78.clients.your-server.de.45550: Flags [.], ack 2, win 58, options [nop,nop,TS val 879462252 ecr 2049662075], length 0
11:33:45.468603 IP static.212.49.46.78.clients.your-server.de.45550 > 10.0.0.13.57474: Flags [F.], seq 1, ack 240, win 43, options [nop,nop,TS val 2049662075 ecr 2809779627], length 0
11:33:45.469034 IP 10.0.0.13.57474 > static.212.49.46.78.clients.your-server.de.45550: Flags [.], ack 2, win 58, options [nop,nop,TS val 2809779876 ecr 2049662075], length 0
11:33:45.484051 IP static.212.49.46.78.clients.your-server.de.45550 > 10.0.0.9.44474: Flags [F.], seq 1, ack 240, win 43, options [nop,nop,TS val 2049662086 ecr 340356957], length 0
11:33:45.484516 IP 10.0.0.9.44474 > static.212.49.46.78.clients.your-server.de.45550: Flags [.], ack 2, win 58, options [nop,nop,TS val 340357207 ecr 2049662086], length 0
11:33:47.269479 IP6 fe80::903f:b7ff:fe4c:22ee > ip6-allrouters: ICMP6, router solicitation, length 16
11:33:48.391332 IP6 fe80::1463:ddff:fe20:e995 > ip6-allrouters: ICMP6, router solicitation, length 16
11:33:50.223907 IP 10.0.0.8.57578 > google-public-dns-a.google.com.domain: 7191+ A? bcn.pool.minergate.com. (40)
11:33:50.223922 IP 10.0.0.8.57578 > google-public-dns-a.google.com.domain: 49711+ AAAA? bcn.pool.minergate.com. (40)
11:33:50.224605 IP 10.0.0.13.54729 > google-public-dns-a.google.com.domain: 57431+ A? bcn.pool.minergate.com. (40)
11:33:50.224614 IP 10.0.0.13.54729 > google-public-dns-a.google.com.domain: 49260+ AAAA? bcn.pool.minergate.com. (40)
11:33:50.226412 IP google-public-dns-a.google.com.domain > 10.0.0.13.54729: 57431 5/0/0 A 46.4.119.208, A 176.9.2.145, A 176.9.147.78, A 94.130.9.194, A 78.46.49.212 (120)
11:33:50.226480 IP google-public-dns-a.google.com.domain > 10.0.0.13.54729: 49260 0/1/0 (121)
11:33:50.226707 IP 10.0.0.13.47840 > static.208.119.4.46.clients.your-server.de.45550: Flags [S], seq 3974532027, win 29200, options [mss 1460,sackOK,TS val 398062594 ecr 0,nop,wscale 9], length 0
11:33:50.249874 IP 10.0.0.9.42664 > google-public-dns-a.google.com.domain: 3234+ A? bcn.pool.minergate.com. (40)
11:33:50.249884 IP 10.0.0.9.42664 > google-public-dns-a.google.com.domain: 50358+ AAAA? bcn.pool.minergate.com. (40)
11:33:50.281356 IP google-public-dns-a.google.com.domain > 10.0.0.8.57578: 49711 0/1/0 (121)
11:33:50.283625 IP google-public-dns-a.google.com.domain > 10.0.0.8.57578: 7191 5/0/0 A 78.46.49.212, A 176.9.2.145, A 46.4.119.208, A 176.9.147.78, A 94.130.9.194 (120)
11:33:50.283846 IP 10.0.0.8.51834 > static.145.2.9.176.clients.your-server.de.45550: Flags [S], seq 3503740181, win 29200, options [mss 1460,sackOK,TS val 3968004635 ecr 0,nop,wscale 9], length 0
11:33:50.304033 IP google-public-dns-a.google.com.domain > 10.0.0.9.42664: 50358 0/1/0 (121)
11:33:50.309369 IP google-public-dns-a.google.com.domain > 10.0.0.9.42664: 3234 5/0/0 A 78.46.49.212, A 176.9.2.145, A 46.4.119.208, A 176.9.147.78, A 94.130.9.194 (120)
11:33:50.309599 IP 10.0.0.9.44480 > static.212.49.46.78.clients.your-server.de.45550: Flags [S], seq 624763321, win 29200, options [mss 1460,sackOK,TS val 340362032 ecr 0,nop,wscale 9], length 0
11:33:50.472384 IP static.208.119.4.46.clients.your-server.de.45550 > 10.0.0.13.47840: Flags [S.], seq 963486193, ack 3974532028, win 65535, options [mss 1460,sackOK,TS val 3888839176 ecr 398062594,nop,wscale 13], length 0
11:33:50.472564 IP 10.0.0.13.47840 > static.208.119.4.46.clients.your-server.de.45550: Flags [.], ack 1, win 58, options [nop,nop,TS val 398062840 ecr 3888839176], length 0
11:33:50.472571 IP 10.0.0.13.47840 > static.208.119.4.46.clients.your-server.de.45550: Flags [P.], seq 1:239, ack 1, win 58, options [nop,nop,TS val 398062840 ecr 3888839176], length 238
11:33:50.531493 IP static.145.2.9.176.clients.your-server.de.45550 > 10.0.0.8.51834: Flags [S.], seq 2898977555, ack 3503740182, win 65535, options [mss 1460,sackOK,TS val 824242962 ecr 3968004635,nop,wscale 13], length 0
11:33:50.531648 IP 10.0.0.8.51834 > static.145.2.9.176.clients.your-server.de.45550: Flags [.], ack 1, win 58, options [nop,nop,TS val 3968004882 ecr 824242962], length 0
11:33:50.531693 IP 10.0.0.8.51834 > static.145.2.9.176.clients.your-server.de.45550: Flags [P.], seq 1:239, ack 1, win 58, options [nop,nop,TS val 3968004882 ecr 824242962], length 238
11:33:50.554864 IP static.212.49.46.78.clients.your-server.de.45550 > 10.0.0.9.44480: Flags [S.], seq 3161584421, ack 624763322, win 65535, options [mss 1460,sackOK,TS val 2049667159 ecr 340362032,nop,wscale 13], length 0
11:33:50.555029 IP 10.0.0.9.44480 > static.212.49.46.78.clients.your-server.de.45550: Flags [.], ack 1, win 58, options [nop,nop,TS val 340362278 ecr 2049667159], length 0
11:33:50.555036 IP 10.0.0.9.44480 > static.212.49.46.78.clients.your-server.de.45550: Flags [P.], seq 1:239, ack 1, win 58, options [nop,nop,TS val 340362278 ecr 2049667159], length 238
11:33:50.718293 IP static.208.119.4.46.clients.your-server.de.45550 > 10.0.0.13.47840: Flags [.], ack 239, win 43, options [nop,nop,TS val 3888839421 ecr 398062840], length 0
11:33:50.779259 IP static.145.2.9.176.clients.your-server.de.45550 > 10.0.0.8.51834: Flags [.], ack 239, win 43, options [nop,nop,TS val 824243210 ecr 3968004882], length 0
11:33:50.800121 IP static.212.49.46.78.clients.your-server.de.45550 > 10.0.0.9.44480: Flags [.], ack 239, win 43, options [nop,nop,TS val 2049667405 ecr 340362278], length 0
11:33:51.204317 IP 10.0.0.5.60174 > google-public-dns-a.google.com.domain: 47781+ A? bcn.pool.minergate.com. (40)
11:33:51.204322 IP 10.0.0.5.60174 > google-public-dns-a.google.com.domain: 41153+ AAAA? bcn.pool.minergate.com. (40)
11:33:51.258520 IP google-public-dns-a.google.com.domain > 10.0.0.5.60174: 41153 0/1/0 (121)
11:33:51.263151 IP google-public-dns-a.google.com.domain > 10.0.0.5.60174: 47781 5/0/0 A 78.46.49.212, A 94.130.9.194, A 46.4.119.208, A 176.9.147.78, A 176.9.2.145 (120)
11:33:51.263374 IP 10.0.0.5.47558 > static.208.119.4.46.clients.your-server.de.45550: Flags [S], seq 1210842096, win 29200, options [mss 1460,sackOK,TS val 2786332184 ecr 0,nop,wscale 9], length 0
11:33:51.511647 IP static.208.119.4.46.clients.your-server.de.45550 > 10.0.0.5.47558: Flags [S.], seq 1349291787, ack 1210842097, win 65535, options [mss 1460,sackOK,TS val 3888840215 ecr 2786332184,nop,wscale 13], length 0
11:33:51.511805 IP 10.0.0.5.47558 > static.208.119.4.46.clients.your-server.de.45550: Flags [.], ack 1, win 58, options [nop,nop,TS val 2786332433 ecr 3888840215], length 0
11:33:51.511813 IP 10.0.0.5.47558 > static.208.119.4.46.clients.your-server.de.45550: Flags [P.], seq 1:239, ack 1, win 58, options [nop,nop,TS val 2786332433 ecr 3888840215], length 238
11:33:52.067211 IP 10.0.0.6 > 239.255.255.250: igmp v2 report 239.255.255.250
11:33:52.218736 IP 10.0.0.5.47558 > static.208.119.4.46.clients.your-server.de.45550: Flags [P.], seq 1:239, ack 1, win 58, options [nop,nop,TS val 2786333139 ecr 3888840215], length 238
11:33:52.319984 IP 10.0.0.7 > 239.255.255.250: igmp v2 report 239.255.255.250
11:33:52.466909 IP static.208.119.4.46.clients.your-server.de.45550 > 10.0.0.5.47558: Flags [.], ack 239, win 43, options [nop,nop,TS val 3888841171 ecr 2786333139,nop,nop,sack 1 {1:239}], length 0
11:33:52.745991 IP 10.0.0.15 > 239.255.255.250: igmp v2 report 239.255.255.250
11:33:52.863565 IP 10.0.0.11 > 239.255.255.250: igmp v2 report 239.255.255.250
11:33:52.932762 IP 10.0.0.12 > 239.255.255.250: igmp v2 report 239.255.255.250
11:33:52.932870 IP 10.0.0.10 > 239.255.255.250: igmp v2 report 239.255.255.250
11:33:52.933019 IP 10.0.0.14 > 239.255.255.250: igmp v2 report 239.255.255.250
11:33:52.933168 IP 10.0.0.16 > 239.255.255.250: igmp v2 report 239.255.255.250
11:33:53.096367 IP 10.0.0.2 > 239.255.255.250: igmp v2 report 239.255.255.250
11:33:53.096397 IP 10.0.0.4 > 239.255.255.250: igmp v2 report 239.255.255.250
11:33:53.096451 IP 10.0.0.3 > 239.255.255.250: igmp v2 report 239.255.255.250
11:33:53.510914 IP6 fe80::d8c9:feff:fe59:58c > ip6-allrouters: ICMP6, router solicitation, length 16
11:34:06.743859 IP 10.1.110.119.17500 > 10.1.255.255.17500: UDP, length 156
11:34:06.743863 IP 10.1.110.119.17500 > 255.255.255.255.17500: UDP, length 156
11:34:06.892493 IP 10.1.110.119.17500 > 255.255.255.255.17500: UDP, length 156
11:34:06.892495 IP 10.1.110.119.17500 > 10.1.255.255.17500: UDP, length 156
11:34:08.077493 IP 10.1.110.119.17500 > 10.1.255.255.17500: UDP, length 156
11:34:08.134003 IP 10.1.110.119.17500 > 10.1.255.255.17500: UDP, length 156
11:34:08.137149 IP 10.1.110.119.17500 > 255.255.255.255.17500: UDP, length 156
11:34:08.195736 IP 10.1.110.119.17500 > 255.255.255.255.17500: UDP, length 156
11:34:08.195788 IP 10.1.110.119.17500 > 10.1.255.255.17500: UDP, length 156
11:34:08.196111 IP 10.1.110.119.17500 > 255.255.255.255.17500: UDP, length 156
11:34:08.196113 IP 10.1.110.119.17500 > 10.1.255.255.17500: UDP, length 156
11:34:08.258075 IP 10.1.110.119.17500 > 255.255.255.255.17500: UDP, length 156
11:34:08.258143 IP 10.1.110.119.17500 > 255.255.255.255.17500: UDP, length 156
11:34:08.325609 IP 10.1.110.119.17500 > 10.1.255.255.17500: UDP, length 156
11:34:08.325613 IP 10.1.110.119.17500 > 255.255.255.255.17500: UDP, length 156
11:34:08.388212 IP 10.1.110.119.17500 > 255.255.255.255.17500: UDP, length 156
11:34:08.388279 IP 10.1.110.119.17500 > 10.1.255.255.17500: UDP, length 156
11:34:08.388315 IP 10.1.110.119.17500 > 10.1.255.255.17500: UDP, length 156
11:34:08.388378 IP 10.1.110.119.17500 > 10.1.255.255.17500: UDP, length 156
11:34:08.388382 IP 10.1.110.119.17500 > 255.255.255.255.17500: UDP, length 156
11:34:08.483036 IP 10.1.110.119.17500 > 255.255.255.255.17500: UDP, length 156
11:34:08.566731 IP 10.1.110.119.17500 > 10.1.255.255.17500: UDP, length 156
11:34:11.224734 IP 10.0.0.8.51834 > static.145.2.9.176.clients.your-server.de.45550: Flags [F.], seq 239, ack 1, win 58, options [nop,nop,TS val 3968025576 ecr 824243210], length 0
11:34:11.225370 IP 10.0.0.13.47840 > static.208.119.4.46.clients.your-server.de.45550: Flags [F.], seq 239, ack 1, win 58, options [nop,nop,TS val 398083593 ecr 3888839421], length 0
11:34:11.271214 IP 10.0.0.9.44480 > static.212.49.46.78.clients.your-server.de.45550: Flags [F.], seq 239, ack 1, win 58, options [nop,nop,TS val 340382994 ecr 2049667405], length 0
11:34:11.391229 IP6 fe80::4053:b9ff:feab:d2d8 > ip6-allrouters: ICMP6, router solicitation, length 16
11:34:11.471135 IP static.208.119.4.46.clients.your-server.de.45550 > 10.0.0.13.47840: Flags [F.], seq 1, ack 240, win 43, options [nop,nop,TS val 3888860174 ecr 398083593], length 0
11:34:11.471489 IP 10.0.0.13.47840 > static.208.119.4.46.clients.your-server.de.45550: Flags [.], ack 2, win 58, options [nop,nop,TS val 398083840 ecr 3888860174], length 0
11:34:11.472345 IP static.145.2.9.176.clients.your-server.de.45550 > 10.0.0.8.51834: Flags [F.], seq 1, ack 240, win 43, options [nop,nop,TS val 824263903 ecr 3968025576], length 0
11:34:11.472659 IP 10.0.0.8.51834 > static.145.2.9.176.clients.your-server.de.45550: Flags [.], ack 2, win 58, options [nop,nop,TS val 3968025824 ecr 824263903], length 0
11:34:11.516329 IP static.212.49.46.78.clients.your-server.de.45550 > 10.0.0.9.44480: Flags [F.], seq 1, ack 240, win 43, options [nop,nop,TS val 2049688121 ecr 340382994], length 0
11:34:11.516892 IP 10.0.0.9.44480 > static.212.49.46.78.clients.your-server.de.45550: Flags [.], ack 2, win 58, options [nop,nop,TS val 340383240 ecr 2049688121], length 0
11:34:12.221068 IP 10.0.0.5.47558 > static.208.119.4.46.clients.your-server.de.45550: Flags [F.], seq 239, ack 1, win 58, options [nop,nop,TS val 2786353142 ecr 3888841171], length 0
11:34:12.469234 IP static.208.119.4.46.clients.your-server.de.45550 > 10.0.0.5.47558: Flags [F.], seq 1, ack 240, win 43, options [nop,nop,TS val 3888861173 ecr 2786353142], length 0
11:34:12.469725 IP 10.0.0.5.47558 > static.208.119.4.46.clients.your-server.de.45550: Flags [.], ack 2, win 58, options [nop,nop,TS val 2786353391 ecr 3888861173], length 0
11:34:16.231747 IP 10.0.0.8.37322 > google-public-dns-a.google.com.domain: 41709+ A? bcn.pool.minergate.com. (40)
11:34:16.231754 IP 10.0.0.8.37322 > google-public-dns-a.google.com.domain: 14858+ AAAA? bcn.pool.minergate.com. (40)
11:34:16.275709 IP 10.0.0.9.54658 > google-public-dns-a.google.com.domain: 42578+ A? bcn.pool.minergate.com. (40)
11:34:16.275720 IP 10.0.0.9.54658 > google-public-dns-a.google.com.domain: 22630+ AAAA? bcn.pool.minergate.com. (40)
11:34:16.285681 IP google-public-dns-a.google.com.domain > 10.0.0.8.37322: 14858 0/1/0 (121)
11:34:16.291983 IP google-public-dns-a.google.com.domain > 10.0.0.8.37322: 41709 5/0/0 A 94.130.9.194, A 176.9.2.145, A 46.4.119.208, A 78.46.49.212, A 176.9.147.78 (120)
11:34:16.292231 IP 10.0.0.8.52962 > static.212.49.46.78.clients.your-server.de.45550: Flags [S], seq 842106338, win 29200, options [mss 1460,sackOK,TS val 879493077 ecr 0,nop,wscale 9], length 0
11:34:16.334634 IP google-public-dns-a.google.com.domain > 10.0.0.9.54658: 42578 5/0/0 A 94.130.9.194, A 176.9.2.145, A 176.9.147.78, A 78.46.49.212, A 46.4.119.208 (120)
11:34:16.337286 IP google-public-dns-a.google.com.domain > 10.0.0.9.54658: 22630 0/1/0 (121)
11:34:16.337521 IP 10.0.0.9.44486 > static.212.49.46.78.clients.your-server.de.45550: Flags [S], seq 118908798, win 29200, options [mss 1460,sackOK,TS val 340388061 ecr 0,nop,wscale 9], length 0
11:34:16.537428 IP static.212.49.46.78.clients.your-server.de.45550 > 10.0.0.8.52962: Flags [S.], seq 4030225137, ack 842106339, win 65535, options [mss 1460,sackOK,TS val 2049693143 ecr 879493077,nop,wscale 13], length 0
11:34:16.537584 IP 10.0.0.8.52962 > static.212.49.46.78.clients.your-server.de.45550: Flags [.], ack 1, win 58, options [nop,nop,TS val 879493322 ecr 2049693143], length 0
11:34:16.537628 IP 10.0.0.8.52962 > static.212.49.46.78.clients.your-server.de.45550: Flags [P.], seq 1:239, ack 1, win 58, options [nop,nop,TS val 879493322 ecr 2049693143], length 238
11:34:16.587370 IP static.212.49.46.78.clients.your-server.de.45550 > 10.0.0.9.44486: Flags [S.], seq 2964577770, ack 118908799, win 65535, options [mss 1460,sackOK,TS val 2049693192 ecr 340388061,nop,wscale 13], length 0
11:34:16.587492 IP 10.0.0.9.44486 > static.212.49.46.78.clients.your-server.de.45550: Flags [.], ack 1, win 58, options [nop,nop,TS val 340388311 ecr 2049693192], length 0
11:34:16.587542 IP 10.0.0.9.44486 > static.212.49.46.78.clients.your-server.de.45550: Flags [P.], seq 1:239, ack 1, win 58, options [nop,nop,TS val 340388311 ecr 2049693192], length 238
11:34:16.783130 IP static.212.49.46.78.clients.your-server.de.45550 > 10.0.0.8.52962: Flags [.], ack 239, win 43, options [nop,nop,TS val 2049693388 ecr 879493322], length 0
11:34:16.836759 IP static.212.49.46.78.clients.your-server.de.45550 > 10.0.0.9.44486: Flags [.], ack 239, win 43, options [nop,nop,TS val 2049693442 ecr 340388311], length 0
11:34:17.225023 IP 10.0.0.13.36352 > google-public-dns-a.google.com.domain: 47832+ A? bcn.pool.minergate.com. (40)
11:34:17.225027 IP 10.0.0.13.36352 > google-public-dns-a.google.com.domain: 60144+ AAAA? bcn.pool.minergate.com. (40)
11:34:17.232570 IP 10.0.0.5.51629 > google-public-dns-a.google.com.domain: 46697+ A? bcn.pool.minergate.com. (40)
11:34:17.232577 IP 10.0.0.5.51629 > google-public-dns-a.google.com.domain: 128+ AAAA? bcn.pool.minergate.com. (40)
11:34:17.284159 IP google-public-dns-a.google.com.domain > 10.0.0.13.36352: 60144 0/1/0 (121)
11:34:17.284768 IP google-public-dns-a.google.com.domain > 10.0.0.13.36352: 47832 5/0/0 A 46.4.119.208, A 176.9.2.145, A 176.9.147.78, A 94.130.9.194, A 78.46.49.212 (120)
11:34:17.284995 IP 10.0.0.13.57492 > static.212.49.46.78.clients.your-server.de.45550: Flags [S], seq 334408411, win 29200, options [mss 1460,sackOK,TS val 2809811692 ecr 0,nop,wscale 9], length 0
11:34:17.289520 IP google-public-dns-a.google.com.domain > 10.0.0.5.51629: 46697 5/0/0 A 78.46.49.212, A 176.9.147.78, A 46.4.119.208, A 176.9.2.145, A 94.130.9.194 (120)
11:34:17.424241 IP google-public-dns-a.google.com.domain > 10.0.0.5.51629: 128 0/1/0 (121)
11:34:17.424502 IP 10.0.0.5.32816 > static.78.147.9.176.clients.your-server.de.45550: Flags [S], seq 382215734, win 29200, options [mss 1460,sackOK,TS val 240497163 ecr 0,nop,wscale 9], length 0
11:34:17.534227 IP static.212.49.46.78.clients.your-server.de.45550 > 10.0.0.13.57492: Flags [S.], seq 3028091509, ack 334408412, win 65535, options [mss 1460,sackOK,TS val 2049694141 ecr 2809811692,nop,wscale 13], length 0
11:34:17.534387 IP 10.0.0.13.57492 > static.212.49.46.78.clients.your-server.de.45550: Flags [.], ack 1, win 58, options [nop,nop,TS val 2809811942 ecr 2049694141], length 0
11:34:17.534432 IP 10.0.0.13.57492 > static.212.49.46.78.clients.your-server.de.45550: Flags [P.], seq 1:239, ack 1, win 58, options [nop,nop,TS val 2809811942 ecr 2049694141], length 238
11:34:17.673290 IP static.78.147.9.176.clients.your-server.de.45550 > 10.0.0.5.32816: Flags [S.], seq 2294507597, ack 382215735, win 65535, options [mss 1460,sackOK,TS val 3300525168 ecr 240497163,nop,wscale 13], length 0
11:34:17.673444 IP 10.0.0.5.32816 > static.78.147.9.176.clients.your-server.de.45550: Flags [.], ack 1, win 58, options [nop,nop,TS val 240497412 ecr 3300525168], length 0
11:34:17.673451 IP 10.0.0.5.32816 > static.78.147.9.176.clients.your-server.de.45550: Flags [P.], seq 1:239, ack 1, win 58, options [nop,nop,TS val 240497412 ecr 3300525168], length 238
11:34:17.783445 IP static.212.49.46.78.clients.your-server.de.45550 > 10.0.0.13.57492: Flags [.], ack 239, win 43, options [nop,nop,TS val 2049694390 ecr 2809811942], length 0
11:34:17.922202 IP static.78.147.9.176.clients.your-server.de.45550 > 10.0.0.5.32816: Flags [.], ack 239, win 43, options [nop,nop,TS val 3300525418 ecr 240497412], length 0
11:34:19.699484 IP 10.0.0.1 > maq03: ICMP echo request, id 15192, seq 1, length 64
11:34:19.699544 IP maq03 > 10.0.0.1: ICMP echo reply, id 15192, seq 1, length 64
11:34:20.059960 IP6 fe80::4876:1dff:fed3:da70 > ip6-allrouters: ICMP6, router solicitation, length 16
11:34:22.115515 IP 10.0.0.1 > maq03: ICMP echo request, id 15198, seq 1, length 64
11:34:22.115535 IP maq03 > 10.0.0.1: ICMP echo reply, id 15198, seq 1, length 64
11:34:24.217355 IP6 fe80::3c68:f5ff:fe82:8d0b.mdns > ff02::fb.mdns: 0 [2q] PTR (QM)? _ipps._tcp.local. PTR (QM)? _ipp._tcp.local. (45)
11:34:24.757048 IP6 fe80::b0b4:b8ff:fe4f:a00c.mdns > ff02::fb.mdns: 0 [2q] PTR (QM)? _ipps._tcp.local. PTR (QM)? _ipp._tcp.local. (45)
11:34:28.074467 IP6 fe80::b0b4:b8ff:fe4f:a00c > ip6-allrouters: ICMP6, router solicitation, length 16
11:34:28.251193 IP6 fe80::8818:b2ff:fef9:9ab8 > ip6-allrouters: ICMP6, router solicitation, length 16
11:34:28.675858 IP6 fe80::d9ab:2882:cc66:5231 > ff02::16: HBH ICMP6, multicast listener report v2, 1 group record(s), length 28
11:34:28.676222 IP6 fe80::6c38:4bff:febc:829f > ip6-allrouters: ICMP6, router solicitation, length 16
11:34:28.768114 IP6 fe80::d9ab:2882:cc66:5231 > ff02::16: HBH ICMP6, multicast listener report v2, 1 group record(s), length 28
11:34:28.768251 IP6 fe80::d9ab:2882:cc66:5231 > ff02::16: HBH ICMP6, multicast listener report v2, 1 group record(s), length 28
11:34:28.835668 IP 10.0.0.6 > all-routers.mcast.net: igmp leave 224.0.0.252
11:34:28.927560 IP 10.0.0.6 > all-routers.mcast.net: igmp leave 224.0.0.252
11:34:28.927605 IP6 fe80::d9ab:2882:cc66:5231 > ff02::16: HBH ICMP6, multicast listener report v2, 1 group record(s), length 28
11:34:28.975650 IP 10.0.0.6 > 224.0.0.252: igmp v2 report 224.0.0.252
11:34:28.975668 IP 10.0.0.6.62810 > 224.0.0.252.hostmon: UDP, length 33
11:34:28.975833 IP 10.0.0.6 > 224.0.0.252: igmp v2 report 224.0.0.252
11:34:28.975994 IP6 fe80::d9ab:2882:cc66:5231 > ff02::16: HBH ICMP6, multicast listener report v2, 1 group record(s), length 28
11:34:28.976142 IP 10.0.0.7 > all-routers.mcast.net: igmp leave 224.0.0.252
11:34:28.976483 IP6 fe80::d9ab:2882:cc66:5231.62810 > ff02::1:3.hostmon: UDP, length 33
11:34:28.976562 IP6 fe80::d9ab:2882:cc66:5231 > ff02::16: HBH ICMP6, multicast listener report v2, 1 group record(s), length 28
11:34:28.976708 IP 10.0.0.7 > 224.0.0.252: igmp v2 report 224.0.0.252
11:34:28.976870 IP6 fe80::d9ab:2882:cc66:5231 > ff02::16: HBH ICMP6, multicast listener report v2, 1 group record(s), length 28
11:34:28.977023 IP 10.0.0.7 > all-routers.mcast.net: igmp leave 224.0.0.252
11:34:28.977166 IP6 fe80::d9ab:2882:cc66:5231 > ff02::16: HBH ICMP6, multicast listener report v2, 1 group record(s), length 28
11:34:29.068928 IP 10.0.0.7 > 224.0.0.252: igmp v2 report 224.0.0.252
11:34:29.070665 IP6 fe80::d9ab:2882:cc66:5231.62810 > ff02::1:3.hostmon: UDP, length 33
11:34:29.070831 IP 10.0.0.7.62810 > 224.0.0.252.hostmon: UDP, length 33
11:34:29.149787 IP 10.0.0.6 > 224.0.0.252: igmp v2 report 224.0.0.252
11:34:29.149788 IP 10.0.0.7 > 224.0.0.252: igmp v2 report 224.0.0.252
11:34:29.149870 IP6 fe80::d9ab:2882:cc66:5231 > ff02::16: HBH ICMP6, multicast listener report v2, 1 group record(s), length 28
11:34:29.318582 IP6 fe80::d9ab:2882:cc66:5231 > ff02::16: HBH ICMP6, multicast listener report v2, 1 group record(s), length 28
11:34:29.600949 IP 10.0.0.7.62810 > 224.0.0.252.hostmon: UDP, length 33
11:34:29.601107 IP6 fe80::d9ab:2882:cc66:5231.62810 > ff02::1:3.hostmon: UDP, length 33
11:34:29.601255 IP6 fe80::d9ab:2882:cc66:5231.62810 > ff02::1:3.hostmon: UDP, length 33
11:34:29.602293 IP 10.0.0.6.62810 > 224.0.0.252.hostmon: UDP, length 33
11:34:31.097080 IP 10.0.0.1 > maq03: ICMP echo request, id 15205, seq 1, length 64
11:34:31.097101 IP maq03 > 10.0.0.1: ICMP echo reply, id 15205, seq 1, length 64
11:34:31.173676 IP 10.0.0.2 > all-routers.mcast.net: igmp leave 224.0.0.252
11:34:31.173812 IP 10.0.0.3 > all-routers.mcast.net: igmp leave 224.0.0.252
11:34:31.173945 IP 10.0.0.4 > all-routers.mcast.net: igmp leave 224.0.0.252
11:34:31.174084 IP6 fe80::d9ab:2882:cc66:5231 > ff02::16: HBH ICMP6, multicast listener report v2, 1 group record(s), length 28
11:34:31.174266 IP6 fe80::d9ab:2882:cc66:5231 > ff02::16: HBH ICMP6, multicast listener report v2, 1 group record(s), length 28
11:34:31.174401 IP6 fe80::d9ab:2882:cc66:5231 > ff02::16: HBH ICMP6, multicast listener report v2, 1 group record(s), length 28
11:34:31.174584 IP6 fe80::d9ab:2882:cc66:5231 > ff02::16: HBH ICMP6, multicast listener report v2, 1 group record(s), length 28
11:34:31.238746 IP6 fe80::d9ab:2882:cc66:5231 > ff02::16: HBH ICMP6, multicast listener report v2, 1 group record(s), length 28
11:34:31.293030 IP6 fe80::d9ab:2882:cc66:5231 > ff02::16: HBH ICMP6, multicast listener report v2, 1 group record(s), length 28
11:34:31.293035 IP 10.0.0.2 > all-routers.mcast.net: igmp leave 224.0.0.252
11:34:31.293078 IP 10.0.0.2 > 224.0.0.252: igmp v2 report 224.0.0.252
11:34:31.355383 IP 10.0.0.2 > 224.0.0.252: igmp v2 report 224.0.0.252
11:34:31.355633 IP6 fe80::d9ab:2882:cc66:5231.62810 > ff02::1:3.hostmon: UDP, length 33
11:34:31.356739 IP 10.0.0.2.62810 > 224.0.0.252.hostmon: UDP, length 33
11:34:31.361208 IP6 fe80::d9ab:2882:cc66:5231 > ff02::16: HBH ICMP6, multicast listener report v2, 1 group record(s), length 28
11:34:31.361354 IP6 fe80::d9ab:2882:cc66:5231 > ff02::16: HBH ICMP6, multicast listener report v2, 1 group record(s), length 28
11:34:31.361500 IP 10.0.0.4 > all-routers.mcast.net: igmp leave 224.0.0.252
11:34:31.361639 IP6 fe80::d9ab:2882:cc66:5231 > ff02::16: HBH ICMP6, multicast listener report v2, 1 group record(s), length 28
11:34:31.361787 IP 10.0.0.4.62810 > 224.0.0.252.hostmon: UDP, length 33
11:34:31.409709 IP 10.0.0.4 > 224.0.0.252: igmp v2 report 224.0.0.252
11:34:31.409829 IP 10.0.0.4 > 224.0.0.252: igmp v2 report 224.0.0.252
11:34:31.409993 IP6 fe80::d9ab:2882:cc66:5231.62810 > ff02::1:3.hostmon: UDP, length 33
11:34:31.410163 IP6 fe80::d9ab:2882:cc66:5231 > ff02::16: HBH ICMP6, multicast listener report v2, 1 group record(s), length 28
11:34:31.410306 IP6 fe80::d9ab:2882:cc66:5231 > ff02::16: HBH ICMP6, multicast listener report v2, 1 group record(s), length 28
11:34:31.464264 IP6 fe80::d9ab:2882:cc66:5231 > ff02::16: HBH ICMP6, multicast listener report v2, 1 group record(s), length 28
11:34:31.464399 IP 10.0.0.3 > 224.0.0.252: igmp v2 report 224.0.0.252
11:34:31.464565 IP 10.0.0.3 > 224.0.0.252: igmp v2 report 224.0.0.252
11:34:31.464713 IP 10.0.0.3 > all-routers.mcast.net: igmp leave 224.0.0.252
11:34:31.464850 IP6 fe80::d9ab:2882:cc66:5231.62810 > ff02::1:3.hostmon: UDP, length 33
11:34:31.464996 IP 10.0.0.3.62810 > 224.0.0.252.hostmon: UDP, length 33
11:34:31.671694 IP 10.0.0.3 > 224.0.0.252: igmp v2 report 224.0.0.252
11:34:31.671843 IP 10.0.0.2 > 224.0.0.252: igmp v2 report 224.0.0.252
11:34:31.671993 IP6 fe80::d9ab:2882:cc66:5231 > ff02::16: HBH ICMP6, multicast listener report v2, 1 group record(s), length 28
11:34:31.672126 IP6 fe80::d9ab:2882:cc66:5231 > ff02::16: HBH ICMP6, multicast listener report v2, 1 group record(s), length 28
11:34:31.672264 IP 10.0.0.4 > 224.0.0.252: igmp v2 report 224.0.0.252
11:34:31.672410 IP6 fe80::d9ab:2882:cc66:5231 > ff02::16: HBH ICMP6, multicast listener report v2, 1 group record(s), length 28
11:34:31.825637 IP6 fe80::d9ab:2882:cc66:5231.62810 > ff02::1:3.hostmon: UDP, length 33
11:34:31.825780 IP 10.0.0.2.62810 > 224.0.0.252.hostmon: UDP, length 33
11:34:31.825928 IP6 fe80::d9ab:2882:cc66:5231.62810 > ff02::1:3.hostmon: UDP, length 33
11:34:31.885473 IP 10.0.0.3.62810 > 224.0.0.252.hostmon: UDP, length 33
11:34:31.979850 IP6 fe80::d9ab:2882:cc66:5231 > ff02::16: HBH ICMP6, multicast listener report v2, 1 group record(s), length 28
11:34:31.980064 IP 10.0.0.15 > all-routers.mcast.net: igmp leave 224.0.0.252
11:34:31.980276 IP6 fe80::d9ab:2882:cc66:5231 > ff02::16: HBH ICMP6, multicast listener report v2, 1 group record(s), length 28
11:34:31.980410 IP6 fe80::d9ab:2882:cc66:5231 > ff02::16: HBH ICMP6, multicast listener report v2, 1 group record(s), length 28
11:34:31.980546 IP6 fe80::d9ab:2882:cc66:5231 > ff02::16: HBH ICMP6, multicast listener report v2, 1 group record(s), length 28
11:34:31.980674 IP 10.0.0.14 > all-routers.mcast.net: igmp leave 224.0.0.252
11:34:31.980806 IP 10.0.0.11 > all-routers.mcast.net: igmp leave 224.0.0.252
11:34:31.980935 IP 10.0.0.12 > all-routers.mcast.net: igmp leave 224.0.0.252
11:34:32.058498 IP6 fe80::d9ab:2882:cc66:5231.62810 > ff02::1:3.hostmon: UDP, length 33
11:34:32.058870 IP 10.0.0.4.62810 > 224.0.0.252.hostmon: UDP, length 33
11:34:32.060173 IP6 fe80::d9ab:2882:cc66:5231 > ff02::16: HBH ICMP6, multicast listener report v2, 1 group record(s), length 28
11:34:32.060301 IP6 fe80::d9ab:2882:cc66:5231 > ff02::16: HBH ICMP6, multicast listener report v2, 1 group record(s), length 28
11:34:32.060431 IP6 fe80::d9ab:2882:cc66:5231 > ff02::16: HBH ICMP6, multicast listener report v2, 1 group record(s), length 28
11:34:32.120484 IP 10.0.0.11 > 224.0.0.252: igmp v2 report 224.0.0.252
11:34:32.120499 IP 10.0.0.14 > 224.0.0.252: igmp v2 report 224.0.0.252
11:34:32.120566 IP6 fe80::d9ab:2882:cc66:5231 > ff02::16: HBH ICMP6, multicast listener report v2, 1 group record(s), length 28
11:34:32.120573 IP 10.0.0.14 > all-routers.mcast.net: igmp leave 224.0.0.252
11:34:32.120577 IP6 fe80::d9ab:2882:cc66:5231 > ff02::16: HBH ICMP6, multicast listener report v2, 1 group record(s), length 28
11:34:32.120674 IP 10.0.0.14 > 224.0.0.252: igmp v2 report 224.0.0.252
11:34:32.120681 IP 10.0.0.14.62810 > 224.0.0.252.hostmon: UDP, length 33
11:34:32.120685 IP6 fe80::d9ab:2882:cc66:5231.62810 > ff02::1:3.hostmon: UDP, length 33
11:34:32.120690 IP6 fe80::d9ab:2882:cc66:5231 > ff02::16: HBH ICMP6, multicast listener report v2, 1 group record(s), length 28
11:34:32.120750 IP6 fe80::d9ab:2882:cc66:5231 > ff02::16: HBH ICMP6, multicast listener report v2, 1 group record(s), length 28
