14:43:49.616625 IP 10.0.0.5.56539 > 8.8.8.8.53: 33281+ A? bcn.pool.minergate.com. (40)
14:43:49.616672 IP 10.0.0.5.56539 > 8.8.8.8.53: 30218+ AAAA? bcn.pool.minergate.com. (40)
14:43:49.616691 IP 10.0.0.8.55498 > 8.8.8.8.53: 45252+ A? bcn.pool.minergate.com. (40)
14:43:49.616722 IP 10.0.0.8.55498 > 8.8.8.8.53: 59098+ AAAA? bcn.pool.minergate.com. (40)
14:43:49.672154 IP 8.8.8.8.53 > 10.0.0.5.56539: 33281 5/0/0 A 94.130.9.194, A 176.9.2.145, A 46.4.119.208, A 78.46.49.212, A 176.9.147.78 (120)
14:43:49.674352 IP 8.8.8.8.53 > 10.0.0.8.55498: 45252 5/0/0 A 46.4.119.208, A 94.130.9.194, A 176.9.147.78, A 78.46.49.212, A 176.9.2.145 (120)
14:43:49.696242 IP 10.0.0.9.49608 > 8.8.8.8.53: 59439+ A? bcn.pool.minergate.com. (40)
14:43:49.696290 IP 10.0.0.9.49608 > 8.8.8.8.53: 23612+ AAAA? bcn.pool.minergate.com. (40)
14:43:49.719011 IP 8.8.8.8.53 > 10.0.0.8.55498: 59098 0/1/0 (121)
14:43:49.719583 IP 10.0.0.8.54700 > 78.46.49.212.45550: Flags [S], seq 3910473688, win 29200, options [mss 1460,sackOK,TS val 2233917 ecr 0,nop,wscale 9], length 0
14:43:49.732078 IP 10.0.0.13.50387 > 8.8.8.8.53: 31920+ A? bcn.pool.minergate.com. (40)
14:43:49.732126 IP 10.0.0.13.50387 > 8.8.8.8.53: 46269+ AAAA? bcn.pool.minergate.com. (40)
14:43:49.733619 IP 8.8.8.8.53 > 10.0.0.13.50387: 31920 5/0/0 A 46.4.119.208, A 176.9.2.145, A 176.9.147.78, A 78.46.49.212, A 94.130.9.194 (120)
14:43:49.755277 IP 8.8.8.8.53 > 10.0.0.9.49608: 59439 5/0/0 A 46.4.119.208, A 94.130.9.194, A 176.9.147.78, A 78.46.49.212, A 176.9.2.145 (120)
14:43:49.814260 IP 8.8.8.8.53 > 10.0.0.5.56539: 30218 0/1/0 (121)
14:43:49.815600 IP 10.0.0.5.55544 > 176.9.147.78.45550: Flags [S], seq 3598519684, win 29200, options [mss 1460,sackOK,TS val 393773186 ecr 0,nop,wscale 9], length 0
14:43:49.829471 IP 8.8.8.8.53 > 10.0.0.13.50387: 46269 0/1/0 (121)
14:43:49.831603 IP 10.0.0.13.55926 > 176.9.2.145.45550: Flags [S], seq 1333885455, win 29200, options [mss 1460,sackOK,TS val 3780324652 ecr 0,nop,wscale 9], length 0
14:43:49.878143 IP 8.8.8.8.53 > 10.0.0.9.49608: 23612 0/1/0 (121)
14:43:49.878684 IP 10.0.0.9.37248 > 94.130.9.194.45550: Flags [S], seq 1195769968, win 29200, options [mss 1460,sackOK,TS val 1343487658 ecr 0,nop,wscale 9], length 0
14:43:49.972686 IP 78.46.49.212.45550 > 10.0.0.8.54700: Flags [S.], seq 2654450645, ack 3910473689, win 65535, options [mss 1460,sackOK,TS val 2579466454 ecr 2233917,nop,wscale 13], length 0
14:43:49.973036 IP 10.0.0.8.54700 > 78.46.49.212.45550: Flags [.], ack 1, win 58, options [nop,nop,TS val 2234170 ecr 2579466454], length 0
14:43:49.973042 IP 10.0.0.8.54700 > 78.46.49.212.45550: Flags [P.], seq 1:239, ack 1, win 58, options [nop,nop,TS val 2234170 ecr 2579466454], length 238
14:43:50.061065 IP 176.9.147.78.45550 > 10.0.0.5.55544: Flags [S.], seq 3752764085, ack 3598519685, win 65535, options [mss 1460,sackOK,TS val 3830307694 ecr 393773186,nop,wscale 13], length 0
14:43:50.061264 IP 10.0.0.5.55544 > 176.9.147.78.45550: Flags [.], ack 1, win 58, options [nop,nop,TS val 393773431 ecr 3830307694], length 0
14:43:50.063487 IP 10.0.0.5.55544 > 176.9.147.78.45550: Flags [P.], seq 1:239, ack 1, win 58, options [nop,nop,TS val 393773434 ecr 3830307694], length 238
14:43:50.080112 IP 176.9.2.145.45550 > 10.0.0.13.55926: Flags [S.], seq 2679395768, ack 1333885456, win 65535, options [mss 1460,sackOK,TS val 1354049528 ecr 3780324652,nop,wscale 13], length 0
14:43:50.080309 IP 10.0.0.13.55926 > 176.9.2.145.45550: Flags [.], ack 1, win 58, options [nop,nop,TS val 3780324901 ecr 1354049528], length 0
14:43:50.083485 IP 10.0.0.13.55926 > 176.9.2.145.45550: Flags [P.], seq 1:239, ack 1, win 58, options [nop,nop,TS val 3780324904 ecr 1354049528], length 238
14:43:50.122342 IP 94.130.9.194.45550 > 10.0.0.9.37248: Flags [S.], seq 2557023029, ack 1195769969, win 65535, options [mss 1460,sackOK,TS val 1416509283 ecr 1343487658,nop,wscale 13], length 0
14:43:50.122536 IP 10.0.0.9.37248 > 94.130.9.194.45550: Flags [.], ack 1, win 58, options [nop,nop,TS val 1343487902 ecr 1416509283], length 0
14:43:50.122585 IP 10.0.0.9.37248 > 94.130.9.194.45550: Flags [P.], seq 1:239, ack 1, win 58, options [nop,nop,TS val 1343487902 ecr 1416509283], length 238
14:43:50.225448 IP 78.46.49.212.45550 > 10.0.0.8.54700: Flags [.], ack 239, win 43, options [nop,nop,TS val 2579466708 ecr 2234170], length 0
14:43:50.308601 IP 176.9.147.78.45550 > 10.0.0.5.55544: Flags [.], ack 239, win 43, options [nop,nop,TS val 3830307941 ecr 393773434], length 0
14:43:50.332417 IP 176.9.2.145.45550 > 10.0.0.13.55926: Flags [.], ack 239, win 43, options [nop,nop,TS val 1354049780 ecr 3780324904], length 0
14:43:50.365706 IP 94.130.9.194.45550 > 10.0.0.9.37248: Flags [.], ack 239, win 43, options [nop,nop,TS val 1416509344 ecr 1343487902], length 0
14:43:57.739132 IP6 fe80::a4da:a7ff:fef7:8865 > ff02::2: ICMP6, router solicitation, length 16
14:44:03.618876 IP 0.0.0.0 > 224.0.0.1: igmp query v2 [max resp time 10] [gaddr 239.255.255.250]
14:44:03.670713 IP 0.0.0.0 > 224.0.0.1: igmp query v2 [max resp time 10] [gaddr 239.255.255.250]
14:44:03.923904 IP 0.0.0.0 > 224.0.0.1: igmp query v2 [max resp time 10] [gaddr 239.255.255.250]
14:44:03.923906 IP 0.0.0.0 > 224.0.0.1: igmp query v2 [max resp time 10] [gaddr 239.255.255.250]
14:44:03.923907 IP 0.0.0.0 > 224.0.0.1: igmp query v2 [max resp time 10] [gaddr 239.255.255.250]
14:44:04.150123 IP 10.0.0.6 > 239.255.255.250: igmp v2 report 239.255.255.250
14:44:04.293113 IP 10.0.0.7 > 239.255.255.250: igmp v2 report 239.255.255.250
14:44:04.296739 IP 0.0.0.0 > 224.0.0.1: igmp query v2 [max resp time 10] [gaddr 239.255.255.250]
14:44:04.296741 IP 0.0.0.0 > 224.0.0.1: igmp query v2 [max resp time 10] [gaddr 239.255.255.250]
14:44:04.384537 IP 0.0.0.0 > 224.0.0.1: igmp query v2 [max resp time 10] [gaddr 239.255.255.250]
14:44:04.384543 IP 0.0.0.0 > 224.0.0.1: igmp query v2 [max resp time 10] [gaddr 239.255.255.250]
14:44:04.384587 IP 0.0.0.0 > 224.0.0.1: igmp query v2 [max resp time 10] [gaddr 239.255.255.250]
14:44:04.555480 IP 0.0.0.0 > 224.0.0.1: igmp query v2 [max resp time 10] [gaddr 239.255.255.250]
14:44:04.555573 IP 10.0.0.2 > 239.255.255.250: igmp v2 report 239.255.255.250
14:44:04.699512 IP 10.0.0.3 > 239.255.255.250: igmp v2 report 239.255.255.250
14:44:04.755574 IP 10.0.0.4 > 239.255.255.250: igmp v2 report 239.255.255.250
14:44:04.811547 IP 10.0.0.15 > 239.255.255.250: igmp v2 report 239.255.255.250
14:44:04.923474 IP 10.0.0.10 > 239.255.255.250: igmp v2 report 239.255.255.250
14:44:04.923580 IP 10.0.0.11 > 239.255.255.250: igmp v2 report 239.255.255.250
14:44:04.975556 IP 10.0.0.14 > 239.255.255.250: igmp v2 report 239.255.255.250
14:44:05.095787 IP 10.0.0.16 > 239.255.255.250: igmp v2 report 239.255.255.250
14:44:05.096289 IP 10.0.0.12 > 239.255.255.250: igmp v2 report 239.255.255.250
14:44:06.351825 IP 0.0.0.0 > 224.0.0.1: igmp query v2
14:44:06.423583 IP 0.0.0.0 > 224.0.0.1: igmp query v2
14:44:06.577586 IP 0.0.0.0 > 224.0.0.1: igmp query v2
14:44:06.681045 IP 0.0.0.0 > 224.0.0.1: igmp query v2
14:44:06.751900 IP 0.0.0.0 > 224.0.0.1: igmp query v2
14:44:06.812661 IP 10.0.0.6 > 224.0.0.252: igmp v2 report 224.0.0.252
14:44:06.870438 IP 10.0.0.6 > 224.0.0.251: igmp v2 report 224.0.0.251
14:44:06.983701 IP 10.0.0.7 > 224.0.0.252: igmp v2 report 224.0.0.252
14:44:06.983706 IP 10.0.0.7 > 224.0.0.251: igmp v2 report 224.0.0.251
14:44:07.044644 IP 10.0.0.2 > 224.0.0.251: igmp v2 report 224.0.0.251
14:44:07.044646 IP 10.0.0.4 > 224.0.0.251: igmp v2 report 224.0.0.251
14:44:07.044700 IP 10.0.0.2 > 224.0.0.252: igmp v2 report 224.0.0.252
14:44:07.044703 IP 10.0.0.4 > 224.0.0.252: igmp v2 report 224.0.0.252
14:44:07.044804 IP 10.0.0.3 > 224.0.0.252: igmp v2 report 224.0.0.252
14:44:07.135511 IP 10.0.0.3 > 224.0.0.251: igmp v2 report 224.0.0.251
14:44:07.179468 IP 0.0.0.0 > 224.0.0.1: igmp query v2
14:44:07.179472 IP 0.0.0.0 > 224.0.0.1: igmp query v2
14:44:07.179475 IP 0.0.0.0 > 224.0.0.1: igmp query v2
14:44:07.179476 IP 0.0.0.0 > 224.0.0.1: igmp query v2
14:44:07.255970 IP 0.0.0.0 > 224.0.0.1: igmp query v2
14:44:07.256033 IP 0.0.0.0 > 224.0.0.1: igmp query v2
14:44:07.371976 IP 10.0.0.15 > 224.0.0.251: igmp v2 report 224.0.0.251
14:44:07.455575 IP 10.0.0.15 > 224.0.0.252: igmp v2 report 224.0.0.252
14:44:07.455677 IP 10.0.0.10 > 224.0.0.252: igmp v2 report 224.0.0.252
14:44:07.455678 IP 10.0.0.11 > 224.0.0.252: igmp v2 report 224.0.0.252
14:44:07.503860 IP 10.0.0.11 > 224.0.0.251: igmp v2 report 224.0.0.251
14:44:07.503864 IP 10.0.0.10 > 224.0.0.251: igmp v2 report 224.0.0.251
14:44:07.503908 IP 10.0.0.14 > 224.0.0.251: igmp v2 report 224.0.0.251
14:44:07.503910 IP 10.0.0.14 > 224.0.0.252: igmp v2 report 224.0.0.252
14:44:07.563883 IP 10.0.0.12 > 224.0.0.251: igmp v2 report 224.0.0.251
14:44:07.663257 IP 10.0.0.12 > 224.0.0.252: igmp v2 report 224.0.0.252
14:44:07.663270 IP 10.0.0.16 > 224.0.0.252: igmp v2 report 224.0.0.252
14:44:07.663283 IP 10.0.0.16 > 224.0.0.251: igmp v2 report 224.0.0.251
14:44:10.605261 IP 10.0.0.8.54700 > 78.46.49.212.45550: Flags [F.], seq 239, ack 1, win 58, options [nop,nop,TS val 2254803 ecr 2579466708], length 0
14:44:10.605515 IP 10.0.0.5.55544 > 176.9.147.78.45550: Flags [F.], seq 239, ack 1, win 58, options [nop,nop,TS val 393793976 ecr 3830307941], length 0
14:44:10.616678 IP 10.0.0.9.37248 > 94.130.9.194.45550: Flags [F.], seq 239, ack 1, win 58, options [nop,nop,TS val 1343508396 ecr 1416509344], length 0
14:44:10.648255 IP 10.0.0.13.55926 > 176.9.2.145.45550: Flags [F.], seq 239, ack 1, win 58, options [nop,nop,TS val 3780345469 ecr 1354049780], length 0
14:44:10.853494 IP 176.9.147.78.45550 > 10.0.0.5.55544: Flags [F.], seq 1, ack 240, win 43, options [nop,nop,TS val 3830328484 ecr 393793976], length 0
14:44:10.862180 IP 78.46.49.212.45550 > 10.0.0.8.54700: Flags [F.], seq 1, ack 240, win 43, options [nop,nop,TS val 2579487340 ecr 2254803], length 0
14:44:10.862627 IP 10.0.0.8.54700 > 78.46.49.212.45550: Flags [.], ack 2, win 58, options [nop,nop,TS val 2255060 ecr 2579487340], length 0
14:44:10.863488 IP 10.0.0.5.55544 > 176.9.147.78.45550: Flags [.], ack 2, win 58, options [nop,nop,TS val 393794234 ecr 3830328484], length 0
14:44:10.899243 IP 176.9.2.145.45550 > 10.0.0.13.55926: Flags [F.], seq 1, ack 240, win 43, options [nop,nop,TS val 1354070345 ecr 3780345469], length 0
14:44:10.899714 IP 10.0.0.13.55926 > 176.9.2.145.45550: Flags [.], ack 2, win 58, options [nop,nop,TS val 3780345720 ecr 1354070345], length 0
14:44:11.331370 IP 10.0.0.9.37248 > 94.130.9.194.45550: Flags [F.], seq 239, ack 1, win 58, options [nop,nop,TS val 1343509111 ecr 1416509344], length 0
14:44:11.452327 IP 94.130.9.194.45550 > 10.0.0.9.37248: Flags [F.], seq 1, ack 240, win 43, options [nop,nop,TS val 1416514616 ecr 1343508396], length 0
14:44:11.452848 IP 10.0.0.9.37248 > 94.130.9.194.45550: Flags [.], ack 2, win 58, options [nop,nop,TS val 1343509232 ecr 1416514616], length 0
14:44:11.574470 IP 94.130.9.194.45550 > 10.0.0.9.37248: Flags [.], ack 240, win 43, options [nop,nop,TS val 1416514646 ecr 1343509111,nop,nop,sack 1 {239:240}], length 0
14:44:14.758706 IP 10.0.0.6 > 239.255.255.250: igmp v2 report 239.255.255.250
14:44:14.758711 IP 10.0.0.7 > 239.255.255.250: igmp v2 report 239.255.255.250
14:44:15.263615 IP 10.0.0.3 > 239.255.255.250: igmp v2 report 239.255.255.250
14:44:15.297259 IP 10.0.0.2 > 239.255.255.250: igmp v2 report 239.255.255.250
14:44:15.297407 IP 10.0.0.4 > 239.255.255.250: igmp v2 report 239.255.255.250
14:44:15.621540 IP 10.0.0.9.42751 > 8.8.8.8.53: 20720+ A? bcn.pool.minergate.com. (40)
14:44:15.621547 IP 10.0.0.9.42751 > 8.8.8.8.53: 1033+ AAAA? bcn.pool.minergate.com. (40)
14:44:15.623906 IP 8.8.8.8.53 > 10.0.0.9.42751: 20720 5/0/0 A 46.4.119.208, A 176.9.2.145, A 176.9.147.78, A 78.46.49.212, A 94.130.9.194 (120)
14:44:15.623936 IP 8.8.8.8.53 > 10.0.0.9.42751: 1033 0/1/0 (121)
14:44:15.624156 IP 10.0.0.9.37250 > 94.130.9.194.45550: Flags [S], seq 3196435111, win 29200, options [mss 1460,sackOK,TS val 1343513404 ecr 0,nop,wscale 9], length 0
14:44:15.872651 IP 94.130.9.194.45550 > 10.0.0.9.37250: Flags [S.], seq 1106657128, ack 3196435112, win 65535, options [mss 1460,sackOK,TS val 1416515720 ecr 1343513404,nop,wscale 13], length 0
14:44:15.872811 IP 10.0.0.9.37250 > 94.130.9.194.45550: Flags [.], ack 1, win 58, options [nop,nop,TS val 1343513653 ecr 1416515720], length 0
14:44:15.872818 IP 10.0.0.9.37250 > 94.130.9.194.45550: Flags [P.], seq 1:239, ack 1, win 58, options [nop,nop,TS val 1343513653 ecr 1416515720], length 238
14:44:15.960325 IP 10.0.0.15 > 239.255.255.250: igmp v2 report 239.255.255.250
14:44:15.960533 IP 10.0.0.14 > 239.255.255.250: igmp v2 report 239.255.255.250
14:44:15.961483 IP 10.0.0.16 > 239.255.255.250: igmp v2 report 239.255.255.250
14:44:16.025253 IP 10.0.0.11 > 239.255.255.250: igmp v2 report 239.255.255.250
14:44:16.110459 IP 10.0.0.10 > 239.255.255.250: igmp v2 report 239.255.255.250
14:44:16.110496 IP 10.0.0.12 > 239.255.255.250: igmp v2 report 239.255.255.250
14:44:16.121242 IP 94.130.9.194.45550 > 10.0.0.9.37250: Flags [.], ack 239, win 43, options [nop,nop,TS val 1416515783 ecr 1343513653], length 0
14:44:16.605109 IP 10.0.0.8.45411 > 8.8.8.8.53: 15566+ A? bcn.pool.minergate.com. (40)
14:44:16.605118 IP 10.0.0.8.45411 > 8.8.8.8.53: 22248+ AAAA? bcn.pool.minergate.com. (40)
14:44:16.608606 IP 8.8.8.8.53 > 10.0.0.8.45411: 15566 5/0/0 A 46.4.119.208, A 94.130.9.194, A 176.9.147.78, A 78.46.49.212, A 176.9.2.145 (120)
14:44:16.608652 IP 10.0.0.5.52230 > 8.8.8.8.53: 16544+ A? bcn.pool.minergate.com. (40)
14:44:16.608657 IP 10.0.0.5.52230 > 8.8.8.8.53: 53428+ AAAA? bcn.pool.minergate.com. (40)
14:44:16.648017 IP 10.0.0.13.49695 > 8.8.8.8.53: 4785+ A? bcn.pool.minergate.com. (40)
14:44:16.648025 IP 10.0.0.13.49695 > 8.8.8.8.53: 50394+ AAAA? bcn.pool.minergate.com. (40)
14:44:16.662664 IP 8.8.8.8.53 > 10.0.0.5.52230: 53428 0/1/0 (121)
14:44:16.665369 IP 8.8.8.8.53 > 10.0.0.5.52230: 16544 5/0/0 A 78.46.49.212, A 176.9.147.78, A 46.4.119.208, A 176.9.2.145, A 94.130.9.194 (120)
14:44:16.665592 IP 10.0.0.5.55552 > 176.9.147.78.45550: Flags [S], seq 1098604406, win 29200, options [mss 1460,sackOK,TS val 393800036 ecr 0,nop,wscale 9], length 0
14:44:16.701662 IP 8.8.8.8.53 > 10.0.0.13.49695: 50394 0/1/0 (121)
14:44:16.704240 IP 8.8.8.8.53 > 10.0.0.8.45411: 22248 0/1/0 (121)
14:44:16.704472 IP 10.0.0.8.54712 > 78.46.49.212.45550: Flags [S], seq 931580594, win 29200, options [mss 1460,sackOK,TS val 2260902 ecr 0,nop,wscale 9], length 0
14:44:16.705765 IP 8.8.8.8.53 > 10.0.0.13.49695: 4785 5/0/0 A 46.4.119.208, A 176.9.2.145, A 78.46.49.212, A 94.130.9.194, A 176.9.147.78 (120)
14:44:16.705981 IP 10.0.0.13.55936 > 176.9.2.145.45550: Flags [S], seq 3715861321, win 29200, options [mss 1460,sackOK,TS val 3780351527 ecr 0,nop,wscale 9], length 0
14:44:16.912970 IP 176.9.147.78.45550 > 10.0.0.5.55552: Flags [S.], seq 373267028, ack 1098604407, win 65535, options [mss 1460,sackOK,TS val 3830334544 ecr 393800036,nop,wscale 13], length 0
14:44:16.913140 IP 10.0.0.5.55552 > 176.9.147.78.45550: Flags [.], ack 1, win 58, options [nop,nop,TS val 393800284 ecr 3830334544], length 0
14:44:16.913146 IP 10.0.0.5.55552 > 176.9.147.78.45550: Flags [P.], seq 1:239, ack 1, win 58, options [nop,nop,TS val 393800284 ecr 3830334544], length 238
14:44:16.952026 IP 78.46.49.212.45550 > 10.0.0.8.54712: Flags [S.], seq 3018674463, ack 931580595, win 65535, options [mss 1460,sackOK,TS val 2579493437 ecr 2260902,nop,wscale 13], length 0
14:44:16.952181 IP 10.0.0.8.54712 > 78.46.49.212.45550: Flags [.], ack 1, win 58, options [nop,nop,TS val 2261150 ecr 2579493437], length 0
14:44:16.952187 IP 10.0.0.8.54712 > 78.46.49.212.45550: Flags [P.], seq 1:239, ack 1, win 58, options [nop,nop,TS val 2261150 ecr 2579493437], length 238
14:44:16.955321 IP 176.9.2.145.45550 > 10.0.0.13.55936: Flags [S.], seq 1973861596, ack 3715861322, win 65535, options [mss 1460,sackOK,TS val 1354076398 ecr 3780351527,nop,wscale 13], length 0
14:44:16.955458 IP 10.0.0.13.55936 > 176.9.2.145.45550: Flags [.], ack 1, win 58, options [nop,nop,TS val 3780351776 ecr 1354076398], length 0
14:44:16.955462 IP 10.0.0.13.55936 > 176.9.2.145.45550: Flags [P.], seq 1:239, ack 1, win 58, options [nop,nop,TS val 3780351776 ecr 1354076398], length 238
14:44:17.156912 IP 176.9.147.78.45550 > 10.0.0.5.55552: Flags [.], ack 239, win 43, options [nop,nop,TS val 3830334792 ecr 393800284], length 0
14:44:17.197767 IP 78.46.49.212.45550 > 10.0.0.8.54712: Flags [.], ack 239, win 43, options [nop,nop,TS val 2579493685 ecr 2261150], length 0
14:44:17.203103 IP 176.9.2.145.45550 > 10.0.0.13.55936: Flags [.], ack 239, win 43, options [nop,nop,TS val 1354076648 ecr 3780351776], length 0
14:44:22.436220 IP 10.0.0.1 > 10.0.0.254: ICMP echo request, id 27014, seq 1, length 64
14:44:22.436270 IP 10.0.0.254 > 10.0.0.1: ICMP echo reply, id 27014, seq 1, length 64
14:44:25.455835 IP 10.0.0.1 > 10.0.0.254: ICMP echo request, id 27021, seq 1, length 64
14:44:25.455885 IP 10.0.0.254 > 10.0.0.1: ICMP echo reply, id 27021, seq 1, length 64
14:44:28.259963 IP 10.1.110.119.17500 > 255.255.255.255.17500: UDP, length 156
14:44:28.259970 IP 10.1.110.119.17500 > 10.1.255.255.17500: UDP, length 156
14:44:28.431188 IP 10.1.110.119.17500 > 255.255.255.255.17500: UDP, length 156
14:44:28.431195 IP 10.1.110.119.17500 > 10.1.255.255.17500: UDP, length 156
14:44:28.991669 IP 10.1.110.119.17500 > 255.255.255.255.17500: UDP, length 156
14:44:29.057414 IP 10.1.110.119.17500 > 255.255.255.255.17500: UDP, length 156
14:44:29.057464 IP 10.1.110.119.17500 > 10.1.255.255.17500: UDP, length 156
14:44:29.057506 IP 10.1.110.119.17500 > 10.1.255.255.17500: UDP, length 156
14:44:29.201316 IP 10.1.110.119.17500 > 10.1.255.255.17500: UDP, length 156
14:44:29.286692 IP 10.1.110.119.17500 > 255.255.255.255.17500: UDP, length 156
14:44:30.488432 IP 10.1.110.119.17500 > 255.255.255.255.17500: UDP, length 156
14:44:30.488490 IP 10.1.110.119.17500 > 10.1.255.255.17500: UDP, length 156
14:44:30.488717 IP 10.1.110.119.17500 > 255.255.255.255.17500: UDP, length 156
14:44:30.579329 IP 10.1.110.119.17500 > 10.1.255.255.17500: UDP, length 156
14:44:30.579359 IP 10.1.110.119.17500 > 10.1.255.255.17500: UDP, length 156
14:44:30.579452 IP 10.1.110.119.17500 > 255.255.255.255.17500: UDP, length 156
14:44:30.639359 IP 10.1.110.119.17500 > 255.255.255.255.17500: UDP, length 156
14:44:30.639430 IP 10.1.110.119.17500 > 10.1.255.255.17500: UDP, length 156
14:44:30.698703 IP 10.1.110.119.17500 > 255.255.255.255.17500: UDP, length 156
14:44:30.698707 IP 10.1.110.119.17500 > 10.1.255.255.17500: UDP, length 156
14:44:30.803924 IP 10.1.110.119.17500 > 255.255.255.255.17500: UDP, length 156
14:44:30.803988 IP 10.1.110.119.17500 > 10.1.255.255.17500: UDP, length 156
14:44:32.479837 IP 10.0.0.1 > 10.0.0.254: ICMP echo request, id 27029, seq 1, length 64
14:44:32.479895 IP 10.0.0.254 > 10.0.0.1: ICMP echo reply, id 27029, seq 1, length 64
14:44:36.648666 IP 10.0.0.9.37250 > 94.130.9.194.45550: Flags [F.], seq 239, ack 1, win 58, options [nop,nop,TS val 1343534428 ecr 1416515783], length 0
14:44:36.899064 IP 94.130.9.194.45550 > 10.0.0.9.37250: Flags [F.], seq 1, ack 240, win 43, options [nop,nop,TS val 1416520977 ecr 1343534428], length 0
14:44:36.899569 IP 10.0.0.9.37250 > 94.130.9.194.45550: Flags [.], ack 2, win 58, options [nop,nop,TS val 1343534680 ecr 1416520977], length 0
14:44:37.605122 IP 10.0.0.8.54712 > 78.46.49.212.45550: Flags [F.], seq 239, ack 1, win 58, options [nop,nop,TS val 2281803 ecr 2579493685], length 0
14:44:37.613609 IP 10.0.0.5.55552 > 176.9.147.78.45550: Flags [F.], seq 239, ack 1, win 58, options [nop,nop,TS val 393820984 ecr 3830334792], length 0
14:44:37.648088 IP 10.0.0.13.55936 > 176.9.2.145.45550: Flags [F.], seq 239, ack 1, win 58, options [nop,nop,TS val 3780372469 ecr 1354076648], length 0
14:44:37.850581 IP 78.46.49.212.45550 > 10.0.0.8.54712: Flags [F.], seq 1, ack 240, win 43, options [nop,nop,TS val 2579514338 ecr 2281803], length 0
14:44:37.851089 IP 10.0.0.8.54712 > 78.46.49.212.45550: Flags [.], ack 2, win 58, options [nop,nop,TS val 2282049 ecr 2579514338], length 0
14:44:37.857307 IP 176.9.147.78.45550 > 10.0.0.5.55552: Flags [F.], seq 1, ack 240, win 43, options [nop,nop,TS val 3830355492 ecr 393820984], length 0
14:44:37.857744 IP 10.0.0.5.55552 > 176.9.147.78.45550: Flags [.], ack 2, win 58, options [nop,nop,TS val 393821229 ecr 3830355492], length 0
14:44:37.895868 IP 176.9.2.145.45550 > 10.0.0.13.55936: Flags [F.], seq 1, ack 240, win 43, options [nop,nop,TS val 1354097341 ecr 3780372469], length 0
14:44:37.896316 IP 10.0.0.13.55936 > 176.9.2.145.45550: Flags [.], ack 2, win 58, options [nop,nop,TS val 3780372717 ecr 1354097341], length 0
14:44:40.509350 IP 10.0.0.1 > 10.0.0.254: ICMP echo request, id 27035, seq 1, length 64
14:44:40.509399 IP 10.0.0.254 > 10.0.0.1: ICMP echo reply, id 27035, seq 1, length 64
14:44:41.653388 IP 10.0.0.9.49875 > 8.8.8.8.53: 18947+ A? bcn.pool.minergate.com. (40)
14:44:41.653395 IP 10.0.0.9.49875 > 8.8.8.8.53: 52251+ AAAA? bcn.pool.minergate.com. (40)
14:44:41.655299 IP 8.8.8.8.53 > 10.0.0.9.49875: 18947 5/0/0 A 78.46.49.212, A 176.9.147.78, A 46.4.119.208, A 176.9.2.145, A 94.130.9.194 (120)
14:44:41.655516 IP 8.8.8.8.53 > 10.0.0.9.49875: 52251 0/1/0 (121)
14:44:41.655721 IP 10.0.0.9.41016 > 176.9.2.145.45550: Flags [S], seq 2658123364, win 29200, options [mss 1460,sackOK,TS val 1274268165 ecr 0,nop,wscale 9], length 0
14:44:41.905991 IP 176.9.2.145.45550 > 10.0.0.9.41016: Flags [S.], seq 3606971279, ack 2658123365, win 65535, options [mss 1460,sackOK,TS val 1354101351 ecr 1274268165,nop,wscale 13], length 0
14:44:41.906138 IP 10.0.0.9.41016 > 176.9.2.145.45550: Flags [.], ack 1, win 58, options [nop,nop,TS val 1274268415 ecr 1354101351], length 0
14:44:41.906142 IP 10.0.0.9.41016 > 176.9.2.145.45550: Flags [P.], seq 1:239, ack 1, win 58, options [nop,nop,TS val 1274268415 ecr 1354101351], length 238
14:44:42.154650 IP 176.9.2.145.45550 > 10.0.0.9.41016: Flags [.], ack 239, win 43, options [nop,nop,TS val 1354101603 ecr 1274268415], length 0
14:44:42.619328 IP 10.0.0.5.52308 > 8.8.8.8.53: 26725+ A? bcn.pool.minergate.com. (40)
14:44:42.619336 IP 10.0.0.5.52308 > 8.8.8.8.53: 22653+ AAAA? bcn.pool.minergate.com. (40)
14:44:42.620930 IP 8.8.8.8.53 > 10.0.0.5.52308: 26725 5/0/0 A 78.46.49.212, A 176.9.2.145, A 46.4.119.208, A 176.9.147.78, A 94.130.9.194 (120)
14:44:42.673242 IP 8.8.8.8.53 > 10.0.0.5.52308: 22653 0/1/0 (121)
14:44:42.673483 IP 10.0.0.5.52742 > 94.130.9.194.45550: Flags [S], seq 3520962301, win 29200, options [mss 1460,sackOK,TS val 1278962196 ecr 0,nop,wscale 9], length 0
14:44:42.918004 IP 94.130.9.194.45550 > 10.0.0.5.52742: Flags [S.], seq 2302945482, ack 3520962302, win 65535, options [mss 1460,sackOK,TS val 1416522482 ecr 1278962196,nop,wscale 13], length 0
14:44:42.918161 IP 10.0.0.5.52742 > 94.130.9.194.45550: Flags [.], ack 1, win 58, options [nop,nop,TS val 1278962440 ecr 1416522482], length 0
14:44:42.918167 IP 10.0.0.5.52742 > 94.130.9.194.45550: Flags [P.], seq 1:239, ack 1, win 58, options [nop,nop,TS val 1278962440 ecr 1416522482], length 238
14:44:43.163761 IP 94.130.9.194.45550 > 10.0.0.5.52742: Flags [.], ack 239, win 43, options [nop,nop,TS val 1416522543 ecr 1278962440], length 0
14:44:43.604883 IP 10.0.0.8.46720 > 8.8.8.8.53: 11452+ A? bcn.pool.minergate.com. (40)
14:44:43.604892 IP 10.0.0.8.46720 > 8.8.8.8.53: 19156+ AAAA? bcn.pool.minergate.com. (40)
14:44:43.606544 IP 8.8.8.8.53 > 10.0.0.8.46720: 11452 5/0/0 A 46.4.119.208, A 94.130.9.194, A 176.9.147.78, A 78.46.49.212, A 176.9.2.145 (120)
14:44:43.606646 IP 8.8.8.8.53 > 10.0.0.8.46720: 19156 0/1/0 (121)
14:44:43.606853 IP 10.0.0.8.42430 > 94.130.9.194.45550: Flags [S], seq 3165701502, win 29200, options [mss 1460,sackOK,TS val 1509875939 ecr 0,nop,wscale 9], length 0
14:44:43.647828 IP 10.0.0.13.60730 > 8.8.8.8.53: 59442+ A? bcn.pool.minergate.com. (40)
14:44:43.647835 IP 10.0.0.13.60730 > 8.8.8.8.53: 28235+ AAAA? bcn.pool.minergate.com. (40)
14:44:43.649444 IP 8.8.8.8.53 > 10.0.0.13.60730: 59442 5/0/0 A 78.46.49.212, A 176.9.2.145, A 94.130.9.194, A 46.4.119.208, A 176.9.147.78 (120)
14:44:43.704506 IP 8.8.8.8.53 > 10.0.0.13.60730: 28235 0/1/0 (121)
14:44:43.711348 IP 10.0.0.13.41188 > 78.46.49.212.45550: Flags [S], seq 349789543, win 29200, options [mss 1460,sackOK,TS val 1607106630 ecr 0,nop,wscale 9], length 0
14:44:43.856998 IP 94.130.9.194.45550 > 10.0.0.8.42430: Flags [S.], seq 1750053290, ack 3165701503, win 65535, options [mss 1460,sackOK,TS val 1416522714 ecr 1509875939,nop,wscale 13], length 0
14:44:43.857144 IP 10.0.0.8.42430 > 94.130.9.194.45550: Flags [.], ack 1, win 58, options [nop,nop,TS val 1509876189 ecr 1416522714], length 0
14:44:43.857190 IP 10.0.0.8.42430 > 94.130.9.194.45550: Flags [P.], seq 1:239, ack 1, win 58, options [nop,nop,TS val 1509876189 ecr 1416522714], length 238
14:44:43.959889 IP 78.46.49.212.45550 > 10.0.0.13.41188: Flags [S.], seq 3364047263, ack 349789544, win 65535, options [mss 1460,sackOK,TS val 2579520442 ecr 1607106630,nop,wscale 13], length 0
14:44:43.960058 IP 10.0.0.13.41188 > 78.46.49.212.45550: Flags [.], ack 1, win 58, options [nop,nop,TS val 1607106878 ecr 2579520442], length 0
14:44:43.960064 IP 10.0.0.13.41188 > 78.46.49.212.45550: Flags [P.], seq 1:239, ack 1, win 58, options [nop,nop,TS val 1607106878 ecr 2579520442], length 238
14:44:44.104286 IP 94.130.9.194.45550 > 10.0.0.8.42430: Flags [.], ack 239, win 43, options [nop,nop,TS val 1416522777 ecr 1509876189], length 0
14:44:44.206900 IP 78.46.49.212.45550 > 10.0.0.13.41188: Flags [.], ack 239, win 43, options [nop,nop,TS val 2579520690 ecr 1607106878], length 0
14:44:48.520846 IP 10.0.0.1 > 10.0.0.254: ICMP echo request, id 27041, seq 1, length 64
14:44:48.520891 IP 10.0.0.254 > 10.0.0.1: ICMP echo reply, id 27041, seq 1, length 64
14:44:50.290831 IP6 fe80::d9ab:2882:cc66:5231 > ff02::16: HBH ICMP6, multicast listener report v2, 1 group record(s), length 28
14:44:50.290990 IP 10.0.0.6 > 224.0.0.2: igmp leave 224.0.0.252
14:44:50.379528 IP6 fe80::d9ab:2882:cc66:5231 > ff02::16: HBH ICMP6, multicast listener report v2, 1 group record(s), length 28
14:44:50.379676 IP6 fe80::d9ab:2882:cc66:5231 > ff02::16: HBH ICMP6, multicast listener report v2, 1 group record(s), length 28
14:44:50.379814 IP 10.0.0.6 > 224.0.0.2: igmp leave 224.0.0.252
14:44:50.380166 IP 10.0.0.6 > 224.0.0.252: igmp v2 report 224.0.0.252
14:44:50.380182 IP 10.0.0.6 > 224.0.0.252: igmp v2 report 224.0.0.252
14:44:50.380518 IP6 fe80::d9ab:2882:cc66:5231.62810 > ff02::1:3.5355: UDP, length 33
14:44:50.380551 IP6 fe80::d9ab:2882:cc66:5231 > ff02::16: HBH ICMP6, multicast listener report v2, 1 group record(s), length 28
14:44:50.448524 IP6 fe80::d9ab:2882:cc66:5231 > ff02::16: HBH ICMP6, multicast listener report v2, 1 group record(s), length 28
14:44:50.448662 IP 10.0.0.7 > 224.0.0.2: igmp leave 224.0.0.252
14:44:50.448813 IP 10.0.0.6.62810 > 224.0.0.252.5355: UDP, length 33
14:44:50.448954 IP6 fe80::d9ab:2882:cc66:5231 > ff02::16: HBH ICMP6, multicast listener report v2, 1 group record(s), length 28
14:44:50.449092 IP 10.0.0.7 > 224.0.0.252: igmp v2 report 224.0.0.252
14:44:50.449234 IP6 fe80::d9ab:2882:cc66:5231 > ff02::16: HBH ICMP6, multicast listener report v2, 1 group record(s), length 28
14:44:50.449370 IP 10.0.0.7 > 224.0.0.2: igmp leave 224.0.0.252
14:44:50.507283 IP6 fe80::d9ab:2882:cc66:5231 > ff02::16: HBH ICMP6, multicast listener report v2, 1 group record(s), length 28
14:44:50.507417 IP 10.0.0.7 > 224.0.0.252: igmp v2 report 224.0.0.252
14:44:50.507560 IP6 fe80::d9ab:2882:cc66:5231.62810 > ff02::1:3.5355: UDP, length 33
14:44:50.507703 IP 10.0.0.7.62810 > 224.0.0.252.5355: UDP, length 33
14:44:50.757373 IP6 fe80::d9ab:2882:cc66:5231 > ff02::16: HBH ICMP6, multicast listener report v2, 1 group record(s), length 28
14:44:50.757513 IP 10.0.0.6 > 224.0.0.252: igmp v2 report 224.0.0.252
14:44:50.757659 IP 10.0.0.7 > 224.0.0.252: igmp v2 report 224.0.0.252
14:44:50.830194 IP6 fe80::d9ab:2882:cc66:5231 > ff02::16: HBH ICMP6, multicast listener report v2, 1 group record(s), length 28
14:44:50.973950 IP6 fe80::d9ab:2882:cc66:5231.62810 > ff02::1:3.5355: UDP, length 33
14:44:50.974092 IP 10.0.0.6.62810 > 224.0.0.252.5355: UDP, length 33
14:44:50.974231 IP6 fe80::d9ab:2882:cc66:5231.62810 > ff02::1:3.5355: UDP, length 33
14:44:51.081622 IP 10.0.0.7.62810 > 224.0.0.252.5355: UDP, length 33
14:44:51.475764 IP 10.0.0.2 > 224.0.0.2: igmp leave 224.0.0.252
14:44:51.475898 IP6 fe80::d9ab:2882:cc66:5231 > ff02::16: HBH ICMP6, multicast listener report v2, 1 group record(s), length 28
14:44:51.476026 IP6 fe80::d9ab:2882:cc66:5231 > ff02::16: HBH ICMP6, multicast listener report v2, 1 group record(s), length 28
14:44:51.476154 IP 10.0.0.3 > 224.0.0.2: igmp leave 224.0.0.252
14:44:51.476280 IP 10.0.0.4 > 224.0.0.2: igmp leave 224.0.0.252
14:44:51.647297 IP6 fe80::d9ab:2882:cc66:5231 > ff02::16: HBH ICMP6, multicast listener report v2, 1 group record(s), length 28
14:44:51.647449 IP6 fe80::d9ab:2882:cc66:5231 > ff02::16: HBH ICMP6, multicast listener report v2, 1 group record(s), length 28
14:44:51.647591 IP6 fe80::d9ab:2882:cc66:5231 > ff02::16: HBH ICMP6, multicast listener report v2, 1 group record(s), length 28
14:44:51.647725 IP 10.0.0.3 > 224.0.0.2: igmp leave 224.0.0.252
14:44:51.647880 IP 10.0.0.3 > 224.0.0.252: igmp v2 report 224.0.0.252
14:44:51.648026 IP6 fe80::d9ab:2882:cc66:5231 > ff02::16: HBH ICMP6, multicast listener report v2, 1 group record(s), length 28
14:44:51.648167 IP 10.0.0.3 > 224.0.0.252: igmp v2 report 224.0.0.252
14:44:51.712262 IP 10.0.0.3.62810 > 224.0.0.252.5355: UDP, length 33
14:44:51.712406 IP6 fe80::d9ab:2882:cc66:5231.62810 > ff02::1:3.5355: UDP, length 33
14:44:51.713391 IP6 fe80::d9ab:2882:cc66:5231 > ff02::16: HBH ICMP6, multicast listener report v2, 1 group record(s), length 28
14:44:51.713533 IP 10.0.0.2.62810 > 224.0.0.252.5355: UDP, length 33
14:44:51.772203 IP 10.0.0.2 > 224.0.0.2: igmp leave 224.0.0.252
14:44:51.772258 IP 10.0.0.2 > 224.0.0.252: igmp v2 report 224.0.0.252
14:44:51.772402 IP 10.0.0.2 > 224.0.0.252: igmp v2 report 224.0.0.252
14:44:51.772548 IP6 fe80::d9ab:2882:cc66:5231 > ff02::16: HBH ICMP6, multicast listener report v2, 1 group record(s), length 28
14:44:51.772690 IP6 fe80::d9ab:2882:cc66:5231.62810 > ff02::1:3.5355: UDP, length 33
14:44:51.772834 IP6 fe80::d9ab:2882:cc66:5231 > ff02::16: HBH ICMP6, multicast listener report v2, 1 group record(s), length 28
14:44:51.773793 IP6 fe80::d9ab:2882:cc66:5231 > ff02::16: HBH ICMP6, multicast listener report v2, 1 group record(s), length 28
14:44:51.773933 IP6 fe80::d9ab:2882:cc66:5231 > ff02::16: HBH ICMP6, multicast listener report v2, 1 group record(s), length 28
14:44:51.774073 IP 10.0.0.4 > 224.0.0.2: igmp leave 224.0.0.252
14:44:51.774213 IP6 fe80::d9ab:2882:cc66:5231 > ff02::16: HBH ICMP6, multicast listener report v2, 1 group record(s), length 28
14:44:51.774352 IP 10.0.0.4 > 224.0.0.252: igmp v2 report 224.0.0.252
14:44:51.886445 IP 10.0.0.4 > 224.0.0.252: igmp v2 report 224.0.0.252
14:44:51.886457 IP6 fe80::d9ab:2882:cc66:5231.62810 > ff02::1:3.5355: UDP, length 33
14:44:51.886460 IP 10.0.0.4.62810 > 224.0.0.252.5355: UDP, length 33
14:44:52.029077 IP 10.0.0.3 > 224.0.0.252: igmp v2 report 224.0.0.252
14:44:52.029242 IP6 fe80::d9ab:2882:cc66:5231 > ff02::16: HBH ICMP6, multicast listener report v2, 1 group record(s), length 28
14:44:52.029390 IP 10.0.0.4 > 224.0.0.252: igmp v2 report 224.0.0.252
14:44:52.029548 IP6 fe80::d9ab:2882:cc66:5231 > ff02::16: HBH ICMP6, multicast listener report v2, 1 group record(s), length 28
14:44:52.029694 IP 10.0.0.2 > 224.0.0.252: igmp v2 report 224.0.0.252
14:44:52.031085 IP6 fe80::d9ab:2882:cc66:5231 > ff02::16: HBH ICMP6, multicast listener report v2, 1 group record(s), length 28
14:44:52.188722 IP6 fe80::d9ab:2882:cc66:5231.62810 > ff02::1:3.5355: UDP, length 33
14:44:52.188774 IP 10.0.0.3.62810 > 224.0.0.252.5355: UDP, length 33
14:44:52.247942 IP6 fe80::d9ab:2882:cc66:5231.62810 > ff02::1:3.5355: UDP, length 33
14:44:52.248069 IP 10.0.0.2.62810 > 224.0.0.252.5355: UDP, length 33
14:44:52.333752 IP6 fe80::d9ab:2882:cc66:5231.62810 > ff02::1:3.5355: UDP, length 33
14:44:52.334122 IP 10.0.0.4.62810 > 224.0.0.252.5355: UDP, length 33
14:44:54.070696 IP6 fe80::d9ab:2882:cc66:5231 > ff02::16: HBH ICMP6, multicast listener report v2, 1 group record(s), length 28
14:44:54.224903 IP6 fe80::d9ab:2882:cc66:5231 > ff02::16: HBH ICMP6, multicast listener report v2, 1 group record(s), length 28
14:44:54.224954 IP 10.0.0.10 > 224.0.0.2: igmp leave 224.0.0.252
14:44:54.225008 IP 10.0.0.15 > 224.0.0.2: igmp leave 224.0.0.252
14:44:54.225060 IP 10.0.0.14 > 224.0.0.2: igmp leave 224.0.0.252
14:44:54.225425 IP6 fe80::d9ab:2882:cc66:5231 > ff02::16: HBH ICMP6, multicast listener report v2, 1 group record(s), length 28
14:44:54.225478 IP6 fe80::d9ab:2882:cc66:5231 > ff02::16: HBH ICMP6, multicast listener report v2, 1 group record(s), length 28
14:44:54.225531 IP 10.0.0.15 > 224.0.0.252: igmp v2 report 224.0.0.252
14:44:54.225533 IP6 fe80::d9ab:2882:cc66:5231 > ff02::16: HBH ICMP6, multicast listener report v2, 1 group record(s), length 28
14:44:54.287368 IP 10.0.0.15 > 224.0.0.2: igmp leave 224.0.0.252
14:44:54.287372 IP6 fe80::d9ab:2882:cc66:5231 > ff02::16: HBH ICMP6, multicast listener report v2, 1 group record(s), length 28
14:44:54.287407 IP 10.0.0.15 > 224.0.0.252: igmp v2 report 224.0.0.252
14:44:54.287409 IP6 fe80::d9ab:2882:cc66:5231.62810 > ff02::1:3.5355: UDP, length 33
14:44:54.287511 IP 10.0.0.15.62810 > 224.0.0.252.5355: UDP, length 33
14:44:54.287564 IP6 fe80::d9ab:2882:cc66:5231 > ff02::16: HBH ICMP6, multicast listener report v2, 1 group record(s), length 28
14:44:54.287617 IP 10.0.0.11 > 224.0.0.2: igmp leave 224.0.0.252
14:44:54.287618 IP6 fe80::d9ab:2882:cc66:5231 > ff02::16: HBH ICMP6, multicast listener report v2, 1 group record(s), length 28
14:44:54.361340 IP6 fe80::d9ab:2882:cc66:5231 > ff02::16: HBH ICMP6, multicast listener report v2, 1 group record(s), length 28
14:44:54.361442 IP6 fe80::d9ab:2882:cc66:5231 > ff02::16: HBH ICMP6, multicast listener report v2, 1 group record(s), length 28
14:44:54.361445 IP6 fe80::d9ab:2882:cc66:5231 > ff02::16: HBH ICMP6, multicast listener report v2, 1 group record(s), length 28
14:44:54.361492 IP 10.0.0.10 > 224.0.0.2: igmp leave 224.0.0.252
14:44:54.361496 IP 10.0.0.10 > 224.0.0.252: igmp v2 report 224.0.0.252
14:44:54.361543 IP 10.0.0.10 > 224.0.0.252: igmp v2 report 224.0.0.252
14:44:54.361768 IP6 fe80::d9ab:2882:cc66:5231.62810 > ff02::1:3.5355: UDP, length 33
14:44:54.445415 IP6 fe80::d9ab:2882:cc66:5231 > ff02::16: HBH ICMP6, multicast listener report v2, 1 group record(s), length 28
14:44:54.445465 IP 10.0.0.10.62810 > 224.0.0.252.5355: UDP, length 33
14:44:54.445497 IP6 fe80::d9ab:2882:cc66:5231 > ff02::16: HBH ICMP6, multicast listener report v2, 1 group record(s), length 28
14:44:54.445546 IP6 fe80::d9ab:2882:cc66:5231 > ff02::16: HBH ICMP6, multicast listener report v2, 1 group record(s), length 28
14:44:54.445548 IP6 fe80::d9ab:2882:cc66:5231 > ff02::16: HBH ICMP6, multicast listener report v2, 1 group record(s), length 28
14:44:54.445595 IP 10.0.0.11 > 224.0.0.252: igmp v2 report 224.0.0.252
14:44:54.445660 IP 10.0.0.11.62810 > 224.0.0.252.5355: UDP, length 33
14:44:54.445663 IP 10.0.0.11 > 224.0.0.252: igmp v2 report 224.0.0.252
14:44:54.445703 IP 10.0.0.11 > 224.0.0.2: igmp leave 224.0.0.252
14:44:54.445759 IP6 fe80::d9ab:2882:cc66:5231.62810 > ff02::1:3.5355: UDP, length 33
14:44:54.445815 IP6 fe80::d9ab:2882:cc66:5231 > ff02::16: HBH ICMP6, multicast listener report v2, 1 group record(s), length 28
14:44:54.503222 IP 10.0.0.14 > 224.0.0.2: igmp leave 224.0.0.252
14:44:54.503314 IP6 fe80::d9ab:2882:cc66:5231 > ff02::16: HBH ICMP6, multicast listener report v2, 1 group record(s), length 28
14:44:54.503523 IP6 fe80::d9ab:2882:cc66:5231.62810 > ff02::1:3.5355: UDP, length 33
14:44:54.503657 IP 10.0.0.14.62810 > 224.0.0.252.5355: UDP, length 33
14:44:54.503789 IP 10.0.0.14 > 224.0.0.252: igmp v2 report 224.0.0.252
14:44:54.503926 IP 10.0.0.14 > 224.0.0.252: igmp v2 report 224.0.0.252
14:44:54.504325 IP6 fe80::d9ab:2882:cc66:5231 > ff02::16: HBH ICMP6, multicast listener report v2, 1 group record(s), length 28
14:44:54.504527 IP 10.0.0.16 > 224.0.0.2: igmp leave 224.0.0.252
14:44:54.504656 IP 10.0.0.12 > 224.0.0.2: igmp leave 224.0.0.252
14:44:54.529130 IP 10.0.0.1 > 10.0.0.254: ICMP echo request, id 27047, seq 1, length 64
14:44:54.529154 IP 10.0.0.254 > 10.0.0.1: ICMP echo reply, id 27047, seq 1, length 64
14:44:54.606137 IP6 fe80::d9ab:2882:cc66:5231 > ff02::16: HBH ICMP6, multicast listener report v2, 1 group record(s), length 28
14:44:54.606270 IP 10.0.0.16 > 224.0.0.252: igmp v2 report 224.0.0.252
14:44:54.606410 IP6 fe80::d9ab:2882:cc66:5231 > ff02::16: HBH ICMP6, multicast listener report v2, 1 group record(s), length 28
14:44:54.606541 IP 10.0.0.16 > 224.0.0.2: igmp leave 224.0.0.252
14:44:54.607990 IP6 fe80::d9ab:2882:cc66:5231 > ff02::16: HBH ICMP6, multicast listener report v2, 1 group record(s), length 28
14:44:54.682460 IP 10.0.0.16 > 224.0.0.252: igmp v2 report 224.0.0.252
14:44:54.682550 IP 10.0.0.16.62810 > 224.0.0.252.5355: UDP, length 33
14:44:54.682679 IP6 fe80::d9ab:2882:cc66:5231.62810 > ff02::1:3.5355: UDP, length 33
14:44:54.682810 IP6 fe80::d9ab:2882:cc66:5231 > ff02::16: HBH ICMP6, multicast listener report v2, 1 group record(s), length 28
14:44:54.682940 IP 10.0.0.12 > 224.0.0.252: igmp v2 report 224.0.0.252
14:44:54.683336 IP 10.0.0.12 > 224.0.0.252: igmp v2 report 224.0.0.252
14:44:54.683463 IP 10.0.0.12 > 224.0.0.2: igmp leave 224.0.0.252
14:44:54.683597 IP6 fe80::d9ab:2882:cc66:5231 > ff02::16: HBH ICMP6, multicast listener report v2, 1 group record(s), length 28
14:44:54.683725 IP6 fe80::d9ab:2882:cc66:5231 > ff02::16: HBH ICMP6, multicast listener report v2, 1 group record(s), length 28
14:44:54.683858 IP 10.0.0.12.62810 > 224.0.0.252.5355: UDP, length 33
14:44:54.683984 IP6 fe80::d9ab:2882:cc66:5231.62810 > ff02::1:3.5355: UDP, length 33
14:44:54.765404 IP 10.0.0.15 > 224.0.0.252: igmp v2 report 224.0.0.252
14:44:54.765413 IP 10.0.0.14 > 224.0.0.252: igmp v2 report 224.0.0.252
14:44:54.765488 IP 10.0.0.10 > 224.0.0.252: igmp v2 report 224.0.0.252
14:44:54.765491 IP 10.0.0.11 > 224.0.0.252: igmp v2 report 224.0.0.252
14:44:54.765533 IP6 fe80::d9ab:2882:cc66:5231 > ff02::16: HBH ICMP6, multicast listener report v2, 1 group record(s), length 28
14:44:54.765536 IP6 fe80::d9ab:2882:cc66:5231 > ff02::16: HBH ICMP6, multicast listener report v2, 1 group record(s), length 28
14:44:54.765560 IP6 fe80::d9ab:2882:cc66:5231 > ff02::16: HBH ICMP6, multicast listener report v2, 1 group record(s), length 28
14:44:54.765587 IP6 fe80::d9ab:2882:cc66:5231 > ff02::16: HBH ICMP6, multicast listener report v2, 1 group record(s), length 28
14:44:54.851282 IP 10.0.0.16 > 224.0.0.252: igmp v2 report 224.0.0.252
14:44:54.851317 IP6 fe80::d9ab:2882:cc66:5231 > ff02::16: HBH ICMP6, multicast listener report v2, 1 group record(s), length 28
14:44:54.851321 IP 10.0.0.12 > 224.0.0.252: igmp v2 report 224.0.0.252
14:44:54.851367 IP6 fe80::d9ab:2882:cc66:5231 > ff02::16: HBH ICMP6, multicast listener report v2, 1 group record(s), length 28
14:44:54.851370 IP6 fe80::d9ab:2882:cc66:5231.62810 > ff02::1:3.5355: UDP, length 33
14:44:54.926891 IP 10.0.0.15.62810 > 224.0.0.252.5355: UDP, length 33
14:44:54.927019 IP6 fe80::d9ab:2882:cc66:5231.62810 > ff02::1:3.5355: UDP, length 33
14:44:55.000332 IP 10.0.0.14.62810 > 224.0.0.252.5355: UDP, length 33
14:44:55.001184 IP6 fe80::d9ab:2882:cc66:5231.62810 > ff02::1:3.5355: UDP, length 33
14:44:55.001315 IP 10.0.0.10.62810 > 224.0.0.252.5355: UDP, length 33
14:44:55.001447 IP6 fe80::d9ab:2882:cc66:5231.62810 > ff02::1:3.5355: UDP, length 33
14:44:55.001572 IP 10.0.0.11.62810 > 224.0.0.252.5355: UDP, length 33
14:44:55.255366 IP6 fe80::d9ab:2882:cc66:5231.62810 > ff02::1:3.5355: UDP, length 33
14:44:55.255494 IP 10.0.0.16.62810 > 224.0.0.252.5355: UDP, length 33
